MarkerID,Marker No.,Title,Subtitle,Add'l Subtitle,Year Erected,Erected By,Latitude (minus=S),Longitude (minus=W),Street Address,City or Town,Section or Quarter,County or Parish,State or Prov.,Location,Missing,Link,First Published,Last Update
158986,,"Working on the Railroad",,,,"National Park Service",38.44324,-107.55520,,"Cimarron",,"Montrose County","Colorado","It is on Morrow Point Dam Road, 0.1 miles north of U.S. 50, on the right when traveling north. ",,https://www.hmdb.org/m.asp?m=158986,10/30/2020,10/30/2020
158987,,"Early Irrigation in the Uncompahgre Valley","A Landscape Transformed",,,"City of Montrose",38.45480,-107.87022,,"Montrose",,"Montrose County","Colorado","",,https://www.hmdb.org/m.asp?m=158987,10/30/2020,10/31/2020
158993,,"Pegmatite Dikes",,,,"National Park Service",38.55545,-107.68700,,"Black Canyon of the Gunnison National Park",,"Montrose County","Colorado","",,https://www.hmdb.org/m.asp?m=158993,10/30/2020,10/30/2020
159001,,"The Painted Wall",,,,"National Park Service",38.58109,-107.71824,,"Black Canyon of the Gunnison National Park",,"Montrose County","Colorado","",,https://www.hmdb.org/m.asp?m=159001,10/30/2020,10/31/2020
159002,,"The Methodist Episcopal Church","Circa 1882",,,,38.48057,-107.87390,"19 South Park Avenue","Montrose",,"Montrose County","Colorado","It is on Park Avenue south of Main Street, on the left when traveling south. ",,https://www.hmdb.org/m.asp?m=159002,10/30/2020,10/30/2020
159094,,"Veterans Memorial",,,1989,"Pearl Harbor Survivors, Western Slope Colorado Chapter No. 3",38.47793,-107.87648,"320 South 1st Street","Montrose",,"Montrose County","Colorado","It is at the intersection of Townsend Avenue (U.S. 550) and 1st Street, on the left when traveling south on Townsend Avenue. ",,https://www.hmdb.org/m.asp?m=159094,11/1/2020,11/1/2020
159102,,"Instrument of Surrender","The End of the Second World War",,,,38.47793,-107.87648,"320 South 1st Street","Montrose",,"Montrose County","Colorado","It is at the intersection of Townsend Avenue (U.S. 550) and 1st Street, on the left when traveling south on Townsend Avenue. ",,https://www.hmdb.org/m.asp?m=159102,11/1/2020,11/1/2020
159106,,"Montrose County Jail",,,1936,,38.47788,-107.87639,"121 South Townsend Avenue","Montrose",,"Montrose County","Colorado","It is at the intersection of Townsend Avenue (U.S. 550) and 1st Street, on the left when traveling south on Townsend Avenue. ",,https://www.hmdb.org/m.asp?m=159106,11/1/2020,11/2/2020
159539,,"Egyptian Theatre","1928",,,"Delta County Historical Society and City of Delta Historic Preservation Board",38.74074,-108.07062,"452 Main Street","Delta",,"Delta County","Colorado","It is on Main Street (U.S. 50) north of 5th Street, on the right when traveling north. ",,https://www.hmdb.org/m.asp?m=159539,11/8/2020,9/28/2022
159540,,"I. Hunter, D.D.S. Building","1900",,,"City of Delta Historic Preservation Board",38.74067,-108.07099,"449 Main Street","Delta",,"Delta County","Colorado","It is on Main Street (U.S. 50) north of 5th Street, on the left when traveling north. ",,https://www.hmdb.org/m.asp?m=159540,11/8/2020,11/8/2020
159551,,"L.A. Hick, M.D. Building","1900",,,"City of Delta Historic Preservation Board",38.74072,-108.07099,"449 Main Street","Delta",,"Delta County","Colorado","It is on Main Street (U.S. 50) north of 5th Street, on the left when traveling north. ",,https://www.hmdb.org/m.asp?m=159551,11/8/2020,11/9/2020
159552,,"Site of Farmers and Merchants Bank",,,,"the Blachly Family",38.74262,-108.07065,"320 Main Street","Delta",,"Delta County","Colorado","It is on Main Street (U.S. 50) north of 4th Street, on the right when traveling north. ",,https://www.hmdb.org/m.asp?m=159552,11/8/2020,9/29/2022
159555,,"Stockham Building","1908",,,"City of Delta Historic Preservation Board",38.74226,-108.07065,"334-338 Main Street","Delta",,"Delta County","Colorado","It is on Main Street (U.S. 50) north of 4th Street, on the right when traveling north. ",,https://www.hmdb.org/m.asp?m=159555,11/8/2020,11/9/2020
159560,,"Delta County Bank Building","1892",,,"Delta County Historical Society and City of Delta Historic Preservation Board",38.74287,-108.07103,"301 Main Street","Delta",,"Delta County","Colorado","It is at the intersection of Main Street (U.S. 50) and 3rd Street, on the right when traveling south on Main Street. ",,https://www.hmdb.org/m.asp?m=159560,11/8/2020,12/23/2024
159565,,"Central School Bell",,,,"Delta County Historical Society",38.74314,-108.07013,"251 Meeker Street","Delta",,"Delta County","Colorado","It is on 3rd Street east of Main Street (U.S. 50), on the left when traveling east. ",,https://www.hmdb.org/m.asp?m=159565,11/8/2020,10/25/2021
159566,,"Delta Jail - 1890",,,,"Delta County Historical Society",38.74315,-108.07011,"251 Meeker Street","Delta",,"Delta County","Colorado","It is on 3rd Street east of Main Street (U.S. 50), on the left when traveling east. ",,https://www.hmdb.org/m.asp?m=159566,11/8/2020,11/8/2020
159568,,"Mangum Memorial Wind-Chime",,,2012,"Delta County Historical Society",38.74315,-108.07011,"251 Meeker Street","Delta",,"Delta County","Colorado","It is on 3rd Street east of Main Street (U.S. 50), on the left when traveling east. ",,https://www.hmdb.org/m.asp?m=159568,11/8/2020,11/8/2020
159570,,"Robert E. Lee Steamboat Bell",,,,"Delta County Historical Society",38.74314,-108.07004,"251 Meeker Street","Delta",,"Delta County","Colorado","It is on 3rd Street east of Main Street (U.S. 50), on the left when traveling east. ",,https://www.hmdb.org/m.asp?m=159570,11/8/2020,11/8/2020
159571,,"Leslie J. Savage Big Bell Collection",,,,"Delta County Historical Society",38.74313,-108.07000,"251 Meeker Street","Delta",,"Delta County","Colorado","It is on 3rd Street east of Main Street (U.S. 50), on the left when traveling east. ",,https://www.hmdb.org/m.asp?m=159571,11/8/2020,11/8/2020
159573,,"First Methodist Episcopal Church of Delta","1910",,,"City of Delta Historic Preservation Board and the United Methodist Church",38.74050,-108.06965,"477 Meeker Street","Delta",,"Delta County","Colorado","It is at the intersection of Meeker Street and 5th Street, on the right when traveling north on Meeker Street. ",,https://www.hmdb.org/m.asp?m=159573,11/8/2020,1/19/2024
159574,,"Presbyterian Church of Delta","1901",,,"City of Delta Historic Preservation Board",38.74184,-108.06969,"135 4th Street","Delta",,"Delta County","Colorado","It is at the intersection of Meeker Street and 4th Street, on the left when traveling north on Meeker Street. ",,https://www.hmdb.org/m.asp?m=159574,11/8/2020,11/9/2020
159578,,"Delta Post Office","1938",,,"City of Delta Historic Preservation Board",38.74196,-108.06921,"360 Meeker Street","Delta",,"Delta County","Colorado","It is at the intersection of Meeker Street and 4th Street, on the right when traveling north on Meeker Street. ",,https://www.hmdb.org/m.asp?m=159578,11/8/2020,11/8/2020
159579,,"Delta Public Library","1911",,,"City of Delta Historic Preservation Board",38.73930,-108.07236,"211 West 6th Street","Delta",,"Delta County","Colorado","It is at the intersection of Palmer Street and 6th Street, on the right when traveling south on Palmer Street. ",,https://www.hmdb.org/m.asp?m=159579,11/8/2020,11/10/2020
159612,,"Upper Serpents Trail","Serpents Trail to Devils Kitchen Trailhead",,,"National Park Service",39.03328,-108.64583,,"Colorado National Monument",,"Mesa County","Colorado","It is on Rim Rock Drive, on the left when traveling west. ",,https://www.hmdb.org/m.asp?m=159612,11/9/2020,9/30/2022
159625,,"John Otto",,,,"National Park Service",39.10085,-108.73460,,"Colorado National Monument",,"Mesa County","Colorado","",,https://www.hmdb.org/m.asp?m=159625,11/9/2020,11/9/2020
159637,,"Stephen Tyng Mather","July 4, 1867 - Jan. 22, 1930",,,"National Park Service",39.10105,-108.73453,,"Colorado National Monument",,"Mesa County","Colorado","",,https://www.hmdb.org/m.asp?m=159637,11/9/2020,6/12/2021
159647,,"The Shape of Independence",,,,"National Park Service",39.09363,-108.73211,,"Colorado National Monument",,"Mesa County","Colorado","",,https://www.hmdb.org/m.asp?m=159647,11/9/2020,11/9/2020
159662,,"Climbing Independence",,,,"National Park Service",39.09364,-108.73213,,"Colorado National Monument",,"Mesa County","Colorado","",,https://www.hmdb.org/m.asp?m=159662,11/9/2020,11/9/2020
159709,,"The Grand View",,,,"National Park Service",39.09032,-108.72399,,"Colorado National Monument",,"Mesa County","Colorado","",,https://www.hmdb.org/m.asp?m=159709,11/10/2020,11/10/2020
159711,,"Ancient Environments",,,,"National Park Service",39.09047,-108.72276,,"Colorado National Monument",,"Mesa County","Colorado","",,https://www.hmdb.org/m.asp?m=159711,11/10/2020,11/10/2020
159715,,"Tragedies on Rim Rock Drive",,,,"National Park Service, U.S. Department of the Interior",39.08983,-108.72405,,"Colorado National Monument",,"Mesa County","Colorado","",,https://www.hmdb.org/m.asp?m=159715,11/10/2020,12/24/2024
159759,,"The Shapes of Erosion",,,,"National Park Service",39.07870,-108.72443,,"Colorado National Monument",,"Mesa County","Colorado","",,https://www.hmdb.org/m.asp?m=159759,11/11/2020,11/11/2020
159762,,"Canyon In A Canyon",,,,"National Park Service",39.03084,-108.68630,,"Colorado National Monument",,"Mesa County","Colorado","",,https://www.hmdb.org/m.asp?m=159762,11/11/2020,11/11/2020
159770,,"Western Slope Vietnam War Memorial Park","Field of Dreams",,2003,"Concerned Citizens and Organizations",39.15295,-108.73614,"340 Colorado Route 340","Fruita",,"Mesa County","Colorado","",,https://www.hmdb.org/m.asp?m=159770,11/11/2020,4/20/2021
159772,,"Dinosaur Diamond","A Dual-State National Scenic Byway",,,"City of Fruita and Museums of Western Colorado",39.15367,-108.73660,"340 Colorado Route 340","Fruita",,"Mesa County","Colorado","",,https://www.hmdb.org/m.asp?m=159772,11/11/2020,11/11/2020
159775,,"Fruita History & Recreation",,,,"City of Fruita",39.15366,-108.73661,"340 Colorado Route 340","Fruita",,"Mesa County","Colorado","",,https://www.hmdb.org/m.asp?m=159775,11/11/2020,1/23/2024
160107,,"Why East? / Who Were The Franciscans?",,"Dominguez y Escalante Expedition 1776 • 1976",1976,"the Colorado Centennial-Bicentennial Commission and the town of Dove Creek",37.76494,-108.90914,,"Dove Creek",,"Dolores County","Colorado","It is at the intersection of U.S. 491 and Guyrene Street, on the right when traveling west on U.S. 491. ",,https://www.hmdb.org/m.asp?m=160107,11/15/2020,12/10/2024
160119,,"War Memorial",,,1953,"Veterans of Foreign Wars Troy Young Post No. 5181 Ladies Auxiliary",37.76489,-108.90891,,"Dove Creek",,"Dolores County","Colorado","It is at the intersection of U.S. 491 and Guyrene Street, on the right when traveling west on U.S. 491. ",,https://www.hmdb.org/m.asp?m=160119,11/15/2020,11/24/2021
160121,,"Dove Creek",,,2001,"Colorado Historical Society, CO DOT, Federal Highway Administration, and CO Division of Wildlife",37.76494,-108.90901,,"Dove Creek",,"Dolores County","Colorado","It is at the intersection of U.S. 491 and Guyrene Street, on the right when traveling west on U.S. 491. ",,https://www.hmdb.org/m.asp?m=160121,11/15/2020,4/5/2024
160128,,"Community and Conflict",,,,"Colorado Historical Society, CO DOT, Federal Highway Administration, and CO Division of Wildlife",37.76494,-108.90898,,"Dove Creek",,"Dolores County","Colorado","It is at the intersection of U.S. 491 and Guyrene Street, on the right when traveling west on U.S. 491. ",,https://www.hmdb.org/m.asp?m=160128,11/15/2020,12/23/2024
160150,,"Gunnison Sage Grouse",,,2001,"Colorado Historical Society, CO DOT, Federal Highway Administration, and CO Division of Wildlife",37.76494,-108.90901,,"Dove Creek",,"Dolores County","Colorado","It is at the intersection of U.S. 491 and Guyrene Street, on the right when traveling west on U.S. 491. ",,https://www.hmdb.org/m.asp?m=160150,11/15/2020,3/26/2022
160155,,"Dove Creek Country",,,,"Colorado Historical Society, CO DOT, Federal Highway Administration, and CO Division of Wildlife",37.76493,-108.90900,,"Dove Creek",,"Dolores County","Colorado","It is at the intersection of U.S. 491 and Guyrene Street, on the right when traveling west on U.S. 491. ",,https://www.hmdb.org/m.asp?m=160155,11/15/2020,12/23/2024
160166,,"Citizens State Bank","(Standard Oil Distributorship) • circa 1933",,,,37.34844,-108.58627,"77 West Main Street","Cortez",,"Montezuma County","Colorado","It is at the intersection of Main Street (U.S. 160) and Chestnut Street, on the left when traveling west on Main Street. ",,https://www.hmdb.org/m.asp?m=160166,11/15/2020,11/15/2020
160169,,"Marshal W.G. Clucas Residence","48 W. Main",,,,37.34876,-108.58641,"48 West Main Street","Cortez",,"Montezuma County","Colorado","It is at the intersection of Chestnut Street and Main Street (U.S. 160), on the right when traveling north on Chestnut Street. ",,https://www.hmdb.org/m.asp?m=160169,11/15/2020,11/16/2020
160176,,"Veterans Memorial","God • Duty • Honor • Country",,1991,,37.34903,-108.57330,"928 East Main Street","Cortez",,"Montezuma County","Colorado","It is at the intersection of Main Street (U.S. 160) and Mildred Road, on the left when traveling east on Main Street. ",,https://www.hmdb.org/m.asp?m=160176,11/15/2020,11/15/2020
160178,,"War Memorial",,,,"Buddy Ward Veterans of Foreign Wars Post 5241 and Auxiliary",37.34907,-108.57323,"928 East Main Street","Cortez",,"Montezuma County","Colorado","It is at the intersection of Main Street (U.S. 160) and Mildred Road, on the left when traveling east on Main Street. ",,https://www.hmdb.org/m.asp?m=160178,11/15/2020,11/15/2020
160180,,"Welcome to the San Juan Skyway",,,,"US Forest Service, Bureau of Land Management, and San Juan Mountains Association",37.34922,-108.57284,"928 East Main Street","Cortez",,"Montezuma County","Colorado","It is on Mildred Road north of Main Street (U.S. 160), on the left when traveling north. ",,https://www.hmdb.org/m.asp?m=160180,11/15/2020,11/15/2020
160181,,"Four Corners Resettled","Community Connections",,,"US Forest Service, Bureau of Land Management, and San Juan Mountains Association",37.34922,-108.57284,"928 East Main Street","Cortez",,"Montezuma County","Colorado","It is on Mildred Road north of Main Street (U.S. 160), on the left when traveling north. ",,https://www.hmdb.org/m.asp?m=160181,11/15/2020,11/15/2020
160230,,"Canyons of the Ancients National Monument",,,,"US Forest Service, Bureau of Land Management, and San Juan Mountains Association",37.34922,-108.57284,"928 East Main Street","Cortez",,"Montezuma County","Colorado","It is on Mildred Road north of Main Street (U.S. 160), on the left when traveling north. ",,https://www.hmdb.org/m.asp?m=160230,11/16/2020,11/16/2020
160236,,"The Native Americans","12,000 Years of History",,,"US Forest Service, Bureau of Land Management, and San Juan Mountains Association",37.34922,-108.57284,"928 East Main Street","Cortez",,"Montezuma County","Colorado","It is on Mildred Road north of Main Street (U.S. 160), on the left when traveling north. ",,https://www.hmdb.org/m.asp?m=160236,11/16/2020,4/13/2024
160240,,"Rocky Mountain Chocolate Factory",,,1992,"Rocky Mountain Chocolate Factory, Inc.",37.26991,-107.88203,"561 Main Avenue","Durango",,"La Plata County","Colorado","It is on Main Avenue south of College Drive, on the right when traveling south. ",,https://www.hmdb.org/m.asp?m=160240,11/16/2020,1/29/2024
160242,,"Main St., Durango circa 1890",,,,,37.27034,-107.88196,"601 Main Avenue","Durango",,"La Plata County","Colorado","It is at the intersection of Main Avenue and College Street, on the left when traveling north on Main Avenue. ",,https://www.hmdb.org/m.asp?m=160242,11/16/2020,5/13/2024
160243,,"Durango - Silverton Narrow Gauge Railroad",,,1967,"National Park Service and American Society of Civil Engineers",37.26914,-107.88247,"479 Main Avenue","Durango",,"La Plata County","Colorado","It is at the intersection of Main Avenue and 5th Street, on the right when traveling south on Main Avenue. ",,https://www.hmdb.org/m.asp?m=160243,11/16/2020,10/7/2021
160299,"6","Early Durango circa 1889",,,2005,"Shan Wells' Moments Project",37.27534,-107.87996,"1060 Main Avenue","Durango",,"La Plata County","Colorado","It is at the intersection of Main Avenue and 11th Street, on the right when traveling north on Main Avenue. ",,https://www.hmdb.org/m.asp?m=160299,11/17/2020,11/17/2020
160303,,"Old Main Post Office Professional Building","Restored 1985",,,,37.27531,-107.87987,"1060 Main Avenue","Durango",,"La Plata County","Colorado","It is at the intersection of Main Avenue and 11th Street, on the right when traveling north on Main Avenue. ",,https://www.hmdb.org/m.asp?m=160303,11/17/2020,11/17/2020
160433,,"La Plata County Freedom Trees",,,2002,"Employees of La Plata County Government",37.29289,-107.87355,"2600 Main Avenue","Durango",,"La Plata County","Colorado","It is on Main Avenue (U.S. 550) north of 26th Street, on the right when traveling north. ",,https://www.hmdb.org/m.asp?m=160433,11/20/2020,11/20/2020
160439,,"Summer of Flames",,,,"La Plata County",37.29253,-107.87369,"2600 Main Avenue","Durango",,"La Plata County","Colorado","It is at the intersection of Main Avenue (U.S. 550) and 26th Street, on the right when traveling north on Main Avenue. ",,https://www.hmdb.org/m.asp?m=160439,11/20/2020,4/29/2021
160441,,"Community of Heroes",,,,"La Plata County",37.29253,-107.87369,"2600 Main Avenue","Durango",,"La Plata County","Colorado","It is at the intersection of Main Avenue (U.S. 550) and 26th Street, on the right when traveling north on Main Avenue. ",,https://www.hmdb.org/m.asp?m=160441,11/20/2020,1/10/2025
160444,,"Seasons of Healing",,,,"La Plata County",37.29253,-107.87369,"2600 Main Avenue","Durango",,"La Plata County","Colorado","It is at the intersection of Main Avenue (U.S. 550) and 26th Street, on the right when traveling north on Main Avenue. ",,https://www.hmdb.org/m.asp?m=160444,11/20/2020,11/20/2020
160451,"17","Southern Durango with views of Smelter Mountain","circa mid-1890s",,2005,"Shan Wells' Moments Project",37.27607,-107.87276,,"Durango",,"La Plata County","Colorado","It is on Rim Drive south of West Campus Court, on the right when traveling south. ",,https://www.hmdb.org/m.asp?m=160451,11/20/2020,4/15/2023
160471,"7","Schroder Store","Coulson Bros.","Bayfield Historic Walking Tour Stop 7",2009,"Town of Bayfield and Colorado Historical Society",37.22522,-107.60115,"64 West Mill Street","Bayfield",,"La Plata County","Colorado","It is on Mill Street east of Pine Street, on the right when traveling east. ",,https://www.hmdb.org/m.asp?m=160471,11/21/2020,12/10/2024
160490,"9","Hotel Central & Akers Motor Co. Garage","Bayfield Historic Walking Tour Stop 9",,2009,"Town of Bayfield and Colorado Historical Society",37.22524,-107.60130,"64 West Mill Street","Bayfield",,"La Plata County","Colorado","It is on Mill Street east of Pine Street, on the right when traveling east. ",,https://www.hmdb.org/m.asp?m=160490,11/21/2020,4/28/2021
160496,"8","H.C. Schroder House","Bayfield Historic Walking Tour Stop 8",,2009,"Town of Bayfield and Colorado Historical Society",37.22524,-107.60151,"90 West Mill Street","Bayfield",,"La Plata County","Colorado","It is on Mill Street east of Pine Street, on the right when traveling east. ",,https://www.hmdb.org/m.asp?m=160496,11/21/2020,4/28/2021
160497,"1","Bayfield Drug Store","Bayfield Historic Walking Tour Stop 1","11 West Mill Street",2009,"Town of Bayfield and Colorado Historical Society",37.22523,-107.60062,"10 West Mill Street","Bayfield",,"La Plata County","Colorado","It is at the intersection of Mill Street and Pearl Street, on the right when traveling east on Mill Street. ",,https://www.hmdb.org/m.asp?m=160497,11/21/2020,7/2/2022
160510,"2","Farmers & Merchant[s] Bank","Bayfield Historic Walking Tour Stop 2","15 E. Mill Street",2009,"Town of Bayfield and Colorado Historical Society",37.22523,-107.60045,"12 West Mill Street","Bayfield",,"La Plata County","Colorado","It is at the intersection of Mill Street and Pearl Street, on the right when traveling east on Mill Street. ",,https://www.hmdb.org/m.asp?m=160510,11/21/2020,4/28/2021
160512,"4","Bayfield Churches","Calvary Presbyterian Church of Pine River, Union Church, Free Methodist Church","Bayfield Walking Tour Stop 4",2009,"Town of Bayfield and Colorado Historical Society",37.22523,-107.59977,"80 East Mill Street","Bayfield",,"La Plata County","Colorado","It is at the intersection of Mill Street and Church Street, on the right when traveling east on Mill Street. ",,https://www.hmdb.org/m.asp?m=160512,11/21/2020,8/18/2022
160518,"3","Newland House and Presbyterian Manse","Bayfield Historic Walking Tour Stop 3",,2009,"Town of Bayfield and Colorado Historical Society",37.22543,-107.59982,"81 East Mill Street","Bayfield",,"La Plata County","Colorado","It is on Mill Street east of Pearl Street, on the left when traveling east. ",,https://www.hmdb.org/m.asp?m=160518,11/21/2020,5/18/2022
160557,"6","Glenn Bros General Store","Bayfield Historic Walking Tour Stop 6","24 E. Mill Street",2009,"Town of Bayfield and Colorado Historical Society",37.22539,-107.60026,"21 Mill Street","Bayfield",,"La Plata County","Colorado","It is on Mill Street east of Pearl Street, on the left when traveling east. ",,https://www.hmdb.org/m.asp?m=160557,11/21/2020,4/28/2021
160560,,"Chimney Rock Artifacts",,,,"Chimney Rock Interpretive Association",37.17471,-107.30314,"3179 Colorado Route 151","Chimney Rock National Monument",,"Archuleta County","Colorado","It can be reached from Chimney Rock Road. ",,https://www.hmdb.org/m.asp?m=160560,11/21/2020,2/1/2025
160561,,"The Great Kiva",,,,"Chimney Rock Interpretive Association",37.17471,-107.30314,"3179 Colorado Route 151","Chimney Rock National Monument",,"Archuleta County","Colorado","It can be reached from Chimney Rock Road. ",,https://www.hmdb.org/m.asp?m=160561,11/21/2020,2/1/2025
160562,,"Pit House Site",,,,"Chimney Rock Interpretive Association",37.17471,-107.30314,"3179 Colorado Route 151","Chimney Rock National Monument",,"Archuleta County","Colorado","It can be reached from Chimney Rock Road. ",,https://www.hmdb.org/m.asp?m=160562,11/21/2020,2/1/2025
160576,,"Rio Grande — A River of Life",,,,"US Forest Service, Bureau of Land Management, and Silver Thread Scenic and Historic Byway",37.66924,-106.64170,"28 Silver Thread Lane","South Fork",,"Rio Grande County","Colorado","",,https://www.hmdb.org/m.asp?m=160576,11/21/2020,2/9/2023
160592,,"Fremont Campsite",,,1928,"State Historical Society of Colorado, Mrs. J. N. Hall Foundation, and the Del Norte Community Club",37.67881,-106.35219,"790 Grand Avenue","Del Norte",,"Rio Grande County","Colorado","It is at the intersection of Grand Avenue (U.S. 160) and Oak Street (State Highway 112), on the left when traveling east on Grand Avenue. ",,https://www.hmdb.org/m.asp?m=160592,11/21/2020,11/21/2020
160601,,"Mark M. Jones, AIA","1943-2016","In Loving Memory",2017,"Justin and Morgan Jones and Rick Garcia",37.67893,-106.35339,,"Del Norte",,"Rio Grande County","Colorado","It is at the intersection of Grand Avenue (U.S. 160) and Spruce Street, on the right when traveling west on Grand Avenue. ",,https://www.hmdb.org/m.asp?m=160601,11/21/2020,11/21/2020
160668,,"Welcome ""<i>Caminante</i>"" to...","Los Caminos Antiguos Scenic & Historic Byway",,,"CO Scenic Byways, CO Historical Society, CO Parks & Wildlife, CO DOT, The Nature Conservancy, and DOI Agencies",37.66276,-105.87032,,"Mosca",,"Alamosa County","Colorado","It is on Lane 6N east of State Highway 17, on the left when traveling east. ",,https://www.hmdb.org/m.asp?m=160668,11/22/2020,11/22/2020
160674,,"Los Caminos Antiguos","Los Caminos Antiguos Scenic & Historic Byway",,,"Sangre de Cristo National Heritage Area",37.66276,-105.87032,,"Mosca",,"Alamosa County","Colorado","It is on Lane 6N east of State Highway 17, on the left when traveling east. ",,https://www.hmdb.org/m.asp?m=160674,11/22/2020,6/7/2024
160677,,"Great Risk for Great Reward","Los Caminos Antiguos Scenic & Historic Byway",,,"CO Scenic Byways, CO Historical Society, CO Parks & Wildlife, CO DOT, The Nature Conservancy, and DOI Agencies",37.66276,-105.87032,,"Mosca",,"Alamosa County","Colorado","It is on Lane 6N east of State Highway 17, on the left when traveling east. ",,https://www.hmdb.org/m.asp?m=160677,11/22/2020,4/29/2021
160679,,"Who Owns This Land?","Los Caminos Antiguos Scenic & Historic Byway",,,"Sangra de Cristo National Heritage Area",37.66276,-105.87032,,"Mosca",,"Alamosa County","Colorado","It is on Lane 6N east of State Highway 17, on the left when traveling east. ",,https://www.hmdb.org/m.asp?m=160679,11/22/2020,4/29/2021
160680,,"Lt. Zebulon Pike's Southwestern Expedition","1806-7",,,,37.66275,-105.87020,,"Mosca",,"Alamosa County","Colorado","It is on Lane 6N east of State Highway 17, on the left when traveling east. ",,https://www.hmdb.org/m.asp?m=160680,11/22/2020,4/15/2023
160687,,"Understanding the Great Sand Dunes System: the Sabkha",,,,"National Park Service",37.66230,-105.60154,,"Mosca",,"Alamosa County","Colorado","It is on Lane 6N, 1.2 miles west of State Highway 150, on the left when traveling west. ",,https://www.hmdb.org/m.asp?m=160687,11/22/2020,11/22/2020
160692,,"L.B. ""Bill"" Casselman","Dedicated to",,,"Moffat - Hooper - Mosca Service League (presumed)",37.66228,-105.60150,,"Mosca",,"Alamosa County","Colorado","It is on Lane 6N, 1.2 miles west of State Highway 150, on the left when traveling west. ",,https://www.hmdb.org/m.asp?m=160692,11/22/2020,12/6/2021
160699,,"Evidence of a Changing World",,,,"National Park Service",37.66227,-105.60148,,"Mosca",,"Alamosa County","Colorado","It is on Lane 6N, 1.2 miles west of State Highway 150, on the left when traveling west. ",,https://www.hmdb.org/m.asp?m=160699,11/22/2020,11/22/2020
