MarkerID,Marker No.,Title,Subtitle,Add'l Subtitle,Year Erected,Erected By,Latitude (minus=S),Longitude (minus=W),Street Address,City or Town,Section or Quarter,County or Parish,State or Prov.,Location,Missing,Link,First Published,Last Update
257358,"24","Pioneer Press: The Fairbanks Daily News-Miner Story","Vignettes in History","Proud to be ALASKAN",1984,"Festival Fairbanks 84 and The Fairbanks Daily News-Miner",64.84433,-147.71972,"516 1st Avenue","Fairbanks","Downtown","Fairbanks North Star Borough","Alaska","It is on 1st Avenue east of Cushman Street, on the left when traveling east. ",,https://www.hmdb.org/m.asp?m=257358,9/22/2024,9/22/2024
257376,"25","History of North Slope Oil Development","Vignettes in History","Proud to be ALASKAN",1984,"Festival Fairbanks '84 and Standard Alaska Production",64.84431,-147.71972,"516 1st Avenue","Fairbanks","Downtown","Fairbanks North Star Borough","Alaska","It is on 1st Avenue east of Cushman Street, on the left when traveling east. ",,https://www.hmdb.org/m.asp?m=257376,9/22/2024,9/22/2024
257381,"29","Construction Affecting Fairbanks","Vignettes in History","Proud to be ALASKAN",1984,"Festival Fairbanks '84 and Alaska International Construction, Inc.",64.84426,-147.71972,"516 1st Avenue","Fairbanks","Downtown","Fairbanks North Star Borough","Alaska","It is on 1st Avenue east of Cushman Street, on the left when traveling east. ",,https://www.hmdb.org/m.asp?m=257381,9/22/2024,9/22/2024
257390,"30","The Trans Alaska Pipeline: An Epic Construction Effort","Vignettes in History","Proud to be Alaskan",1984,"Festival Fairbanks 84 and Alyeska Pipeline Service Company",64.84426,-147.71970,"516 1st Avenue","Fairbanks","Downtown","Fairbanks North Star Borough","Alaska","It is on 1st Avenue east of Cushman Street, on the left when traveling east. ",,https://www.hmdb.org/m.asp?m=257390,9/22/2024,3/27/2025
257398,"31","A History of Interior Alaska's Transportation","Vignettes in History","Proud to be ALASKAN",1984,"Festival Fairbanks '84 and Varied Alaskan Transportation Entities",64.84424,-147.71968,"516 1st Avenue","Fairbanks","Downtown","Fairbanks North Star Borough","Alaska","It is on 1st Avenue east of Cushman Street, on the left when traveling east. ",,https://www.hmdb.org/m.asp?m=257398,9/22/2024,9/22/2024
257405,"35","Pioneers of Alaska Igloo No. 4 and Auxiliary No. 8","Vignettes in History","Proud to be ALASKAN",1984,"Festival Fairbanks 84 and Pioneers of Alaska Igloo No. 4",64.84425,-147.71959,"516 1st Avenue","Fairbanks","Downtown","Fairbanks North Star Borough","Alaska","It is on 1st Avenue east of Cushman Street, on the left when traveling east. ",,https://www.hmdb.org/m.asp?m=257405,9/22/2024,9/22/2024
257406,"36","University of Alaska—Fairbanks","Vignettes in History","Proud to be ALASKAN",1984,"Festival Fairbanks '84 and University of Alaska-Fairbanks",64.84422,-147.71958,"516 1st Avenue","Fairbanks","Downtown","Fairbanks North Star Borough","Alaska","It is on 1st Avenue east of Cushman Street, on the left when traveling east. ",,https://www.hmdb.org/m.asp?m=257406,9/22/2024,9/22/2024
257409,"40","North Slope Oil Benefits All Of Us","Vignettes in History","Proud to be ALASKAN",1984,"Festival Fairbanks 84 and ARCO Alaska, Inc.",64.84410,-147.71978,"516 1st Avenue","Fairbanks","Downtown","Fairbanks North Star Borough","Alaska","It is on 1st Avenue east of Cushman Street, on the left when traveling east. ",,https://www.hmdb.org/m.asp?m=257409,9/22/2024,9/22/2024
257414,"41","The Military in the Interior","Vignettes in History","Proud to be ALASKAN",,"Festival Fairbanks '84 and Veteran Service Organizations",64.84411,-147.71982,"516 1st Avenue","Fairbanks","Downtown","Fairbanks North Star Borough","Alaska","It is on 1st Avenue east of Cushman Street, on the left when traveling east. ",,https://www.hmdb.org/m.asp?m=257414,9/22/2024,9/22/2024
257421,,"SS Nenana's Three Captains",,,,"Fairbanks North Star Borough Parks and Recreation",64.83906,-147.77221,"2300 Airport Way","Fairbanks",,"Fairbanks North Star Borough","Alaska","",,https://www.hmdb.org/m.asp?m=257421,9/23/2024,9/23/2024
257425,"44","Fairbanks Aerie No. 1037 and Ladies Auxiliary","Fraternal Order of Eagles","Vignettes of History • Proud to be Alaskan",,"Festival Fairbanks 84 and Fairbanks Aerie No. 1037",64.84413,-147.71991,"516 1st Avenue","Fairbanks","Downtown","Fairbanks North Star Borough","Alaska","It is on 1st Avenue east of Cushman Street, on the left when traveling east. ",,https://www.hmdb.org/m.asp?m=257425,9/22/2024,9/22/2024
257426,"44","First National Bank of Fairbanks","Vignettes in History","Proud to be ALASKAN",,"Festival Fairbanks 84 and Key Bank",64.84413,-147.71991,"516 1st Avenue","Fairbanks","Downtown","Fairbanks North Star Borough","Alaska","It is on 1st Avenue east of Cushman Street, on the left when traveling east. ",,https://www.hmdb.org/m.asp?m=257426,9/22/2024,9/22/2024
257433,"48","Pioneer Missionary Activity In Interior Alaska","A Select Chronology of","Vignettes of History • Proud to be Alaskan",,"Festival Fairbanks '84",64.84416,-147.72000,"516 1st Avenue","Fairbanks","Downtown","Fairbanks North Star Borough","Alaska","It is on 1st Avenue east of Cushman Street, on the left when traveling east. ",,https://www.hmdb.org/m.asp?m=257433,9/23/2024,1/3/2025
257435,"51","Sled Dogs in the History of the Interior","Vignettes in History","Proud to be ALASKAN",,"Festival Fairbanks '84",64.84421,-147.72002,"516 1st Avenue","Fairbanks","Downtown","Fairbanks North Star Borough","Alaska","It is on 1st Avenue east of Cushman Street, on the left when traveling east. ",,https://www.hmdb.org/m.asp?m=257435,9/23/2024,9/23/2024
257436,"59","Four Generations on the Yukon","Vignettes in History","Proud to be ALASKAN",,"Festival Fairbanks '84",64.84449,-147.71923,"516 1st Avenue","Fairbanks","Downtown","Fairbanks North Star Borough","Alaska","It is on 1st Avenue east of Cushman Street, on the left when traveling east. ",,https://www.hmdb.org/m.asp?m=257436,9/23/2024,9/23/2024
257439,,"Sluice Box","""Fairbanks Gold Rush""",,,"Fairbanks Princess Riverside Lodge",64.83392,-147.84828,"4477 Pikes Landing Road","College","Pike's Landing","Fairbanks North Star Borough","Alaska","It can be reached from Pikes Landing Road. ",,https://www.hmdb.org/m.asp?m=257439,9/23/2024,9/23/2024
257446,,"Constitution Hall","Alaska Centennial 1867 • 1967",,1967,"State of Alaska Centennial Commission",64.85724,-147.82197,"1692 Tok Lane","College",,"Fairbanks North Star Borough","Alaska","It can be reached from Tok Lane. ",,https://www.hmdb.org/m.asp?m=257446,9/23/2024,9/23/2024
257448,,"Charles E. Bunnell",,,,"University of Alaska Fairbanks",64.85612,-147.82017,"1810 Salcha Street","College",,"Fairbanks North Star Borough","Alaska","It is on Salcha Street, on the left when traveling east. ",,https://www.hmdb.org/m.asp?m=257448,9/23/2024,9/23/2024
257452,,"Engineers","Fundatori Mundi","1922 Tradition 1967",1967,"University of Alaska Fairbanks Engineering Students",64.85627,-147.81872,"1760 Tanana Loop","College",,"Fairbanks North Star Borough","Alaska","",,https://www.hmdb.org/m.asp?m=257452,9/23/2024,9/23/2024
257454,,"The Cornerstone: A Symbol",,,,"University of Alaska Fairbanks",64.85581,-147.81902,"1764 Tanana Loop","College",,"Fairbanks North Star Borough","Alaska","It can be reached from Tanana Loop. ",,https://www.hmdb.org/m.asp?m=257454,9/23/2024,9/23/2024
257459,,"The Cornerstone's Origin",,,,"University of Alaska Fairbanks",64.85581,-147.81908,"1764 Tanana Loop","College",,"Fairbanks North Star Borough","Alaska","",,https://www.hmdb.org/m.asp?m=257459,9/23/2024,9/23/2024
257461,,"Welcome to Fairbanks",,,,"Fairbanks Princess Riverside Lodge",64.83395,-147.84779,"4477 Pikes Landing Road","College","Pike's Landing","Fairbanks North Star Borough","Alaska","It can be reached from Pikes Landing Road. ",,https://www.hmdb.org/m.asp?m=257461,9/23/2024,9/23/2024
257466,,"Bear Cache & Alaskan Cabins",,,,"Fairbanks Princess Riverside Lodge",64.83425,-147.84475,"4477 Pikes Landing Road","College","Pike's Landing","Fairbanks North Star Borough","Alaska","It can be reached from Hoselton Road. ",,https://www.hmdb.org/m.asp?m=257466,9/23/2024,9/24/2024
257471,,"Reindeer & Caribou",,,,"Fairbanks Princess Riverside Lodge",64.83375,-147.84577,"4477 Pikes Landing Road","College","Pike's Landing","Fairbanks North Star Borough","Alaska","It can be reached from Pikes Landing Road. ",,https://www.hmdb.org/m.asp?m=257471,9/24/2024,1/3/2025
257473,,"Pipeline",,,,"Fairbanks Princess Riverside Lodge",64.83355,-147.84559,"4477 Pikes Landing Road","College","Pike's Landing","Fairbanks North Star Borough","Alaska","It can be reached from Pikes Landing Road. ",,https://www.hmdb.org/m.asp?m=257473,9/24/2024,9/24/2024
257476,,"Alaska vs the ""Lower 48""",,,,"Fairbanks Princess Riverside Lodge",64.83339,-147.84707,"4477 Pikes Landing Road","College","Pike's Landing","Fairbanks North Star Borough","Alaska","It can be reached from Pikes Landing Road. ",,https://www.hmdb.org/m.asp?m=257476,9/24/2024,1/3/2025
257477,,"Historic Fairbanks",,,,"Fairbanks Princess Riverside Lodge",64.83301,-147.84696,"4477 Pikes Landing Road","College","Pike's Landing","Fairbanks North Star Borough","Alaska","It can be reached from Pikes Landing Road. ",,https://www.hmdb.org/m.asp?m=257477,9/24/2024,9/24/2024
257480,,"Welcome to our Chef's garden!","We're so glad you're here!",,,"Fairbanks Princess Riverside Lodge and Sustain Alaska and the Yukon",64.83310,-147.84876,"4477 Pikes Landing Road","College","Pike's Landing","Fairbanks North Star Borough","Alaska","It can be reached from Pikes Landing Road. ",,https://www.hmdb.org/m.asp?m=257480,9/24/2024,9/24/2024
257481,,"Pioneering Prospectors",,,2017,"Fairbanks Men's Igloo No.4 and Women's Igloo No.8, Pioneers of Alaska",64.83859,-147.77620,"2300 Airport Way","Fairbanks",,"Fairbanks North Star Borough","Alaska","",,https://www.hmdb.org/m.asp?m=257481,9/24/2024,1/3/2025
257482,,"The Arduous Work of Prospecting in Alaska",,,,"Fairbanks North Star Borough Parks and Recreation",64.83859,-147.77620,"2300 Airport Way","Fairbanks",,"Fairbanks North Star Borough","Alaska","",,https://www.hmdb.org/m.asp?m=257482,9/24/2024,1/3/2025
257483,,"Some of the First Men to Prospect the Fairbanks District Mining Claims",,,,"Fairbanks North Star Borough Parks and Recreation",64.83859,-147.77620,"2300 Airport Way","Fairbanks",,"Fairbanks North Star Borough","Alaska","",,https://www.hmdb.org/m.asp?m=257483,9/24/2024,1/3/2025
257485,,"Placer Drill",,,,"Fairbanks North Star Borough Parks and Recreation",64.83869,-147.77600,"2300 Airport Way","Fairbanks",,"Fairbanks North Star Borough","Alaska","",,https://www.hmdb.org/m.asp?m=257485,9/24/2024,9/24/2024
257486,,"Steam Operated Shovel",,,,"Fairbanks North Star Borough Parks and Recreation",64.83868,-147.77591,"2300 Airport Way","Fairbanks",,"Fairbanks North Star Borough","Alaska","",,https://www.hmdb.org/m.asp?m=257486,9/24/2024,9/24/2024
257487,,"Alaska's First Pipeline",,,,"Fairbanks North Star Borough Parks and Recreation",64.83865,-147.77588,"2300 Airport Way","Fairbanks",,"Fairbanks North Star Borough","Alaska","",,https://www.hmdb.org/m.asp?m=257487,9/24/2024,9/24/2024
257488,,"Model Dredge",,,,"Fairbanks North Star Borough Parks and Recreation",64.83862,-147.77577,"2300 Airport Way","Fairbanks",,"Fairbanks North Star Borough","Alaska","",,https://www.hmdb.org/m.asp?m=257488,9/24/2024,9/24/2024
257489,,"Citizen's Mill (1909-1915)",,,,"Fairbanks North Star Borough Parks and Recreation",64.83867,-147.77574,"2300 Airport Way","Fairbanks",,"Fairbanks North Star Borough","Alaska","",,https://www.hmdb.org/m.asp?m=257489,9/24/2024,9/24/2024
257490,,"Stamp Milling",,,,"Fairbanks North Star Borough Parks and Recreation",64.83866,-147.77571,"2300 Airport Way","Fairbanks",,"Fairbanks North Star Borough","Alaska","",,https://www.hmdb.org/m.asp?m=257490,9/24/2024,9/24/2024
257491,,"E.T. Barnette","Founder, Swindler, Shady Trader, Banker","Fairbanks, Alaska",,"Pike's Waterfront Lodge",64.83181,-147.84831,"1850 Hoselton Road","Fairbanks","Pike's Landing","Fairbanks North Star Borough","Alaska","It can be reached from Hoselton Road. ",,https://www.hmdb.org/m.asp?m=257491,9/24/2024,9/24/2024
257493,,"Felix Pedro","Felice Pedroni's 1902 Goldrush","Fairbanks, Alaska",,"Pike's Waterfront Lodge",64.83181,-147.84839,"1850 Hoselton Road","College","Pike's Landing","Fairbanks North Star Borough","Alaska","It can be reached from Hoselton Road. ",,https://www.hmdb.org/m.asp?m=257493,9/24/2024,9/24/2024
257495,"1","Mary Hammer","Dome Creek Hoist Woman","Cabin 1",,"Pike's Waterfront Lodge",64.83197,-147.84835,"1850 Hoselton Road","College","Pike's Landing","Fairbanks North Star Borough","Alaska","It can be reached from Hoselton Road. ",,https://www.hmdb.org/m.asp?m=257495,9/24/2024,9/24/2024
257496,"2","William Sherwin","""Woodsaw Bill""","Cabin 2",,"Pike's Waterfront Lodge",64.83198,-147.84814,"1850 Hoselton Road","College","Pike's Landing","Fairbanks North Star Borough","Alaska","It can be reached from Hoselton Road. ",,https://www.hmdb.org/m.asp?m=257496,9/24/2024,9/26/2024
257501,,"McCarty Family","Banquet in the Water","Cabin 3",,"Pike's Waterfront Lodge",64.83200,-147.84795,"1850 Hoselton Road","College","Pike's Landing","Fairbanks North Star Borough","Alaska","It can be reached from Hoselton Road. ",,https://www.hmdb.org/m.asp?m=257501,9/24/2024,9/24/2024
257502,"4","""Wise Mike"" Stepovich","Dog Ran Away With Gold Brick","Cabin 4",,"Pike's Waterfront Lodge",64.83206,-147.84780,"1850 Hoselton Road","College","Pike's Landing","Fairbanks North Star Borough","Alaska","It can be reached from Hoselton Road. ",,https://www.hmdb.org/m.asp?m=257502,9/24/2024,9/24/2024
257504,"5","Charlie Thompson","The Californias Baseball Team","Cabin 5",,"Pike's Waterfront Lodge",64.83213,-147.84769,"1850 Hoselton Road","College","Pike's Landing","Fairbanks North Star Borough","Alaska","It can be reached from Hoselton Road. ",,https://www.hmdb.org/m.asp?m=257504,9/24/2024,9/24/2024
257506,"6","LeRoy Tozier","Attorney & First President of Fairbanks Pioneeers [sic]","Cabin 6",,"Pike's Waterfront Lodge",64.83222,-147.84763,"1850 Hoselton Road","College","Pike's Landing","Fairbanks North Star Borough","Alaska","It can be reached from Hoselton Road. ",,https://www.hmdb.org/m.asp?m=257506,9/24/2024,9/24/2024
257509,"7","Mysterious Mr. Raffles","Man of Mystery","Cabin 7",,"Pike's Waterfront Lodge",64.83231,-147.84764,"1850 Hoselton Road","College","Pike's Landing","Fairbanks North Star Borough","Alaska","It can be reached from Hoselton Road. ",,https://www.hmdb.org/m.asp?m=257509,9/24/2024,9/24/2024
257510,"8","Kitty Hensley","Kitty Hensley House at Pioneer Park","Cabin 8",,"Pike's Waterfront Lodge",64.83238,-147.84773,"1850 Hoselton Road","College","Pike's Landing","Fairbanks North Star Borough","Alaska","It can be reached from Hoselton Road. ",,https://www.hmdb.org/m.asp?m=257510,9/24/2024,9/24/2024
257512,"9","Pete and Dick Bucholz","Fairbanks Famous Pet Moose","Cabin 9",,"Pike's Waterfront Lodge",64.83245,-147.84784,"1850 Hoselton Road","College","Pike's Landing","Fairbanks North Star Borough","Alaska","It can be reached from Pikes Landing Road. ",,https://www.hmdb.org/m.asp?m=257512,9/24/2024,9/24/2024
257514,"10","Golden Heart City","Famous Fairbanks Advertising Campaign","Cabin 10",,"Pike's Waterfront Lodge",64.83250,-147.84799,"1850 Hoselton Road","College","Pike's Landing","Fairbanks North Star Borough","Alaska","It can be reached from Pikes Landing Road. ",,https://www.hmdb.org/m.asp?m=257514,9/24/2024,9/24/2024
257516,"11","Cordelia Karshner","First Homesteader in the Tanana","Cabin 11",,"Pike's Waterfront Lodge",64.83253,-147.84818,"1850 Hoselton Road","College","Pike's Landing","Fairbanks North Star Borough","Alaska","It can be reached from Pikes Landing Road. ",,https://www.hmdb.org/m.asp?m=257516,9/24/2024,1/3/2025
257517,"12","Laura Foster O'Flanagan","The Hard Journey North","Cabin 12",,"Pike's Waterfront Lodge",64.83253,-147.84838,"1850 Hoselton Road","College","Pike's Landing","Fairbanks North Star Borough","Alaska","It can be reached from Pikes Landing Road. ",,https://www.hmdb.org/m.asp?m=257517,9/24/2024,9/24/2024
257533,"13","Cecil Clegg","Father of Alaska Day","Cabin 13",,"Pike's Waterfront Lodge",64.83231,-147.84749,"1850 Hoselton Road","College","Pike's Landing","Fairbanks North Star Borough","Alaska","It can be reached from Hoselton Road. ",,https://www.hmdb.org/m.asp?m=257533,9/25/2024,9/25/2024
257534,"14","Jewatha Brice","African American Women of Fairbanks","Cabin 14",,"Pike's Waterfront Lodge",64.83244,-147.84748,"1850 Hoselton Road","College","Pike's Landing","Fairbanks North Star Borough","Alaska","It can be reached from Pikes Landing Road. ",,https://www.hmdb.org/m.asp?m=257534,9/25/2024,1/3/2025
257535,"15","""Two Step"" Louis Schmidt","Big Spender of Klondike & Alaska","Cabin 15",,"Pike's Waterfront Lodge",64.83249,-147.84724,"4477 Pikes Landing Rd","College","Pike's Landing","Fairbanks North Star Borough","Alaska","It can be reached from Pikes Landing Road. ",,https://www.hmdb.org/m.asp?m=257535,9/25/2024,9/25/2024
257536,"16","Felix, Joy, & Dandy Pedro","Death of Joy, Felix Pedro's Dog","Cabin 16",,"Pike's Waterfront Lodge",64.83248,-147.84705,"1850 Hoselton Road","College","Pike's Landing","Fairbanks North Star Borough","Alaska","It can be reached from Hoselton Road. ",,https://www.hmdb.org/m.asp?m=257536,9/25/2024,9/25/2024
257537,"17","William Salmon & August Conradt","The First Stampeders to Arrive in Fairbanks","Cabin 17",,"Pike's Waterfront Lodge",64.83242,-147.84681,"1850 Hoselton Road","College","Pike's Landing","Fairbanks North Star Borough","Alaska","It can be reached from Hoselton Road. ",,https://www.hmdb.org/m.asp?m=257537,9/25/2024,1/3/2025
257538,"18","Edward M. Keyes","Chatanika's Dynamite Hogs","Cabin 18",,"Pike's Waterfront Lodge",64.83229,-147.84683,"1850 Hoselton Road","College","Pike's Landing","Fairbanks North Star Borough","Alaska","It can be reached from Hoselton Road. ",,https://www.hmdb.org/m.asp?m=257538,9/25/2024,9/25/2024
257540,"19","Alphonso L'Kievicz","Goldsmith, Miner & Dredger","Cabin 19",,"Pike's Waterfront Lodge",64.83223,-147.84710,"1850 Hoselton Road","College","Pike's Landing","Fairbanks North Star Borough","Alaska","It can be reached from Hoselton Road. ",,https://www.hmdb.org/m.asp?m=257540,9/25/2024,9/25/2024
257542,"20","Nellie Parsons","1908 Chinook Basketball Team","Cabin 20",,"Pike's Waterfront Lodge",64.83224,-147.84727,"1850 Hoselton Road","College","Pike's Landing","Fairbanks North Star Borough","Alaska","It can be reached from Hoselton Road. ",,https://www.hmdb.org/m.asp?m=257542,9/25/2024,9/25/2024
257544,"21","John Rafliff","John the Bearhunter","Cabin 21",,"Pike's Waterfront Lodge",64.83212,-147.84752,"1850 Hoselton Road","College","Pike's Landing","Fairbanks North Star Borough","Alaska","It can be reached from Hoselton Road. ",,https://www.hmdb.org/m.asp?m=257544,9/25/2024,9/25/2024
257545,"22","""Mushon"" Jansa & ""Waterfront"" Brown","Betting on Elections Fairbanks Style","Cabin 22",,"Pike's Waterfront Lodge",64.83219,-147.84727,"1850 Hoselton Road","College","Pike's Landing","Fairbanks North Star Borough","Alaska","It can be reached from Hoselton Road. ",,https://www.hmdb.org/m.asp?m=257545,9/25/2024,9/25/2024
257548,"23","Whiskers","The Gambling Dog","Cabin 23",,"Pike's Waterfront Lodge",64.83218,-147.84710,"1850 Hoselton Road","College","Pike's Landing","Fairbanks North Star Borough","Alaska","It can be reached from Hoselton Road. ",,https://www.hmdb.org/m.asp?m=257548,9/25/2024,9/25/2024
257549,"24","Carnation Evaporated Milk","Glass Parka for the Klondike Cow","Cabin 24",,"Pike's Waterfront Lodge",64.83211,-147.84686,"1850 Hoselton Road","College","Pike's Landing","Fairbanks North Star Borough","Alaska","It can be reached from Hoselton Road. ",,https://www.hmdb.org/m.asp?m=257549,9/25/2024,9/25/2024
257550,"25","Charles Hendrickson","The Notorious Blue Parka Bandit","Cabin 25",,"Pike's Waterfront Lodge",64.83199,-147.84688,"1850 Hoselton Road","College","Pike's Landing","Fairbanks North Star Borough","Alaska","It can be reached from Hoselton Road. ",,https://www.hmdb.org/m.asp?m=257550,9/25/2024,9/25/2024
257551,"26","Minnie Geis","History Making Candidate","Cabin 26",,"Pike's Waterfront Lodge",64.83193,-147.84712,"1850 Hoselton Road","College","Pike's Landing","Fairbanks North Star Borough","Alaska","It can be reached from Hoselton Road. ",,https://www.hmdb.org/m.asp?m=257551,9/25/2024,9/25/2024
257552,"27","Jessie Bloom","Fairbanks Founder of Montessori & Girl Scouts","Cabin 27",,"Pike's Waterfront Lodge",64.83194,-147.84733,"1850 Hoselton Road","College","Pike's Landing","Fairbanks North Star Borough","Alaska","It can be reached from Hoselton Road. ",,https://www.hmdb.org/m.asp?m=257552,9/25/2024,9/25/2024
257553,"28","Fannie Quigley","""Fannie Fells Her Moose""","Cabin 28",,"Pike's Waterfront Lodge",64.83201,-147.84753,"1850 Hoselton Road","College","Pike's Landing","Fairbanks North Star Borough","Alaska","It can be reached from Hoselton Road. ",,https://www.hmdb.org/m.asp?m=257553,9/25/2024,9/25/2024
257555,,"A Little About Our Beautiful Cabins","Enjoy a Walking Tour of Well Known, Little Known & Notorious","Goldrush Pioneers of Fairbanks",,"Pike's Waterfront Lodge",64.83182,-147.84755,"1850 Hoselton Road","College","Pike's Landing","Fairbanks North Star Borough","Alaska","It can be reached from Hoselton Road. ",,https://www.hmdb.org/m.asp?m=257555,9/25/2024,9/25/2024
257556,,"In Honor of Captain Jim Binkley","May 16, 1920 - January 3, 2003",,,"Riverboat Discovery",64.83016,-147.86542,"1975 Discovery Drive","College","Broadmoor","Fairbanks North Star Borough","Alaska","It is on Discovery Drive. ",,https://www.hmdb.org/m.asp?m=257556,9/25/2024,9/25/2024
257568,,"Sod Roof Construction","<i>A Natural Insulation</i>",,,"Riverboat Discovery",64.80017,-147.91629,"2655 Tall Spruce Rd","Chena Ridge","Chena Native Village","Fairbanks North Star Borough","Alaska","It can be reached from Tall Spruce Road. ",,https://www.hmdb.org/m.asp?m=257568,9/25/2024,9/25/2024
257570,,"Trapper's Line Cabin","<i>A Safe Haven on the Trail</i>",,,"Riverboat Discovery",64.80015,-147.91617,"2655 Tall Spruce Rd","Chena Ridge","Chena Native Village","Fairbanks North Star Borough","Alaska","It can be reached from Tall Spruce Road. ",,https://www.hmdb.org/m.asp?m=257570,9/25/2024,9/25/2024
257571,,"Trapper's Log Cabin","<i>The Classic Alaskan Structure</i>",,,"Riverboat Discovery",64.79994,-147.91630,"2655 Tall Spruce Rd","Chena Ridge","Chena Native Village","Fairbanks North Star Borough","Alaska","It can be reached from Tall Spruce Road. ",,https://www.hmdb.org/m.asp?m=257571,9/25/2024,9/26/2024
257576,,"The Heyday of Snowmobiling","<i>Early 1970's</i>",,,"Riverboat Discovery",64.80000,-147.91697,"2655 Tall Spruce Rd","Chena Ridge","Chena Native Village","Fairbanks North Star Borough","Alaska","It can be reached from Tall Spruce Road. ",,https://www.hmdb.org/m.asp?m=257576,9/25/2024,9/25/2024
257577,,"The Iron Dog","Named by villagers when the first snowmobiles came to Alaska",,,"Riverboat Discovery",64.80000,-147.91697,"2655 Tall Spruce Rd","Chena Ridge","Chena Native Village","Fairbanks North Star Borough","Alaska","It can be reached from Tall Spruce Road. ",,https://www.hmdb.org/m.asp?m=257577,9/25/2024,9/25/2024
257579,,"Early Alaskan Riverboats","Long, Narrow and Efficient",,,"Riverboat Discovery",64.80000,-147.91697,"2655 Tall Spruce Rd","Chena Ridge","Chena Native Village","Fairbanks North Star Borough","Alaska","It can be reached from Tall Spruce Road. ",,https://www.hmdb.org/m.asp?m=257579,9/25/2024,9/25/2024
257582,,"Piper Super Cub","The Trademark Plane of the Alaskan Bush Pilot",,,"Riverboat Discovery",64.79967,-147.91704,"2655 Tall Spruce Rd","Chena Ridge","Chena Native Village","Fairbanks North Star Borough","Alaska","It can be reached from Tall Spruce Road. ",,https://www.hmdb.org/m.asp?m=257582,9/25/2024,9/25/2024
257588,,"Chief John Silas' Cabin",,,,"Riverboat Discovery",64.79976,-147.91737,"2655 Tall Spruce Rd","Chena Ridge","Chena Native Village","Fairbanks North Star Borough","Alaska","",,https://www.hmdb.org/m.asp?m=257588,9/26/2024,9/26/2024
257590,,"Locked to the End",,,,"Riverboat Discovery",64.80002,-147.91534,"2633 Tall Spruce Rd","Chena Ridge","Chena Native Village","Fairbanks North Star Borough","Alaska","It can be reached from Tall Spruce Road. ",,https://www.hmdb.org/m.asp?m=257590,9/26/2024,9/28/2024
257591,,"Locked to the End",,,,"Riverboat Discovery",64.79996,-147.91530,"2633 Tall Spruce Rd","Chena Ridge","Chena Native Village","Fairbanks North Star Borough","Alaska","It can be reached from Tall Spruce Road. ",,https://www.hmdb.org/m.asp?m=257591,9/26/2024,9/26/2024
257592,,"Steamboat Wood","Early Steamboats Relied on Wood for Fuel",,,"Riverboat Discovery",64.80043,-147.91411,"2633 Tall Spruce Rd","Chena Ridge","Chena Native Village","Fairbanks North Star Borough","Alaska","It can be reached from Tall Spruce Road. ",,https://www.hmdb.org/m.asp?m=257592,9/26/2024,9/26/2024
257593,,"Smokehouse","<i>A Way to Preserve Salmon for Winter Consumption</i>",,,"Riverboat Discovery",64.80035,-147.91399,"2633 Tall Spruce Rd","Chena Ridge","Chena Native Village","Fairbanks North Star Borough","Alaska","It can be reached from Tall Spruce Road. ",,https://www.hmdb.org/m.asp?m=257593,9/26/2024,9/26/2024
257597,,"Fish Camp","<i>The First Permanent Food Source for the Athabascans and their Dogs</i>",,,"Riverboat Discovery",64.80035,-147.91395,"2633 Tall Spruce Rd","Chena Ridge","Chena Native Village","Fairbanks North Star Borough","Alaska","It can be reached from Tall Spruce Road. ",,https://www.hmdb.org/m.asp?m=257597,9/26/2024,9/26/2024
