MarkerID,Marker No.,Title,Subtitle,Add'l Subtitle,Year Erected,Erected By,Latitude (minus=S),Longitude (minus=W),Street Address,City or Town,Section or Quarter,County or Parish,State or Prov.,Location,Missing,Link,First Published,Last Update
129522,,"Kent World War I Memorial",,,,,51.27934,1.08514,,"Canterbury",,"Kent","England","It can be reached from the intersection of Burgate and Sun Street, on the right when traveling west. ",,https://www.hmdb.org/m.asp?m=129522,2/3/2019,1/27/2022
129523,,"Royal East Kent Yeomanry Memorial",,,,,51.27881,1.08011,"46-47 High Street","Canterbury",,"Kent","England","It is at the intersection of High Street and Mercery Lane, on the left when traveling north on High Street. ",,https://www.hmdb.org/m.asp?m=129523,2/3/2019,1/27/2022
129525,,"James Simmons",,,,,51.27996,1.07862,"23 High Street","Canterbury",,"Kent","England","It is at the intersection of High Street and Best Lane, on the right when traveling north on High Street. ",,https://www.hmdb.org/m.asp?m=129525,2/3/2019,1/27/2022
129526,,"High Street Bridge",,,,,51.27996,1.07861,"23 High Street","Canterbury",,"Kent","England","It is on High Street close to  Best Lane, on the right when traveling north. ",,https://www.hmdb.org/m.asp?m=129526,2/3/2019,1/27/2022
129527,,"Westgate",,,,,51.28152,1.07601,"1 Pound Lane","Canterbury",,"Kent","England","It is at the intersection of St Peter’s Place and Pound Lane, on the right when traveling north on St Peter’s Place. ",,https://www.hmdb.org/m.asp?m=129527,2/3/2019,1/27/2022
129600,,"Christopher Marlowe",,,,,51.28067,1.07812,,"Canterbury",,"Kent","England","It is at the intersection of The Friars and St Peter’s Street, on the left when traveling east on The Friars. ",,https://www.hmdb.org/m.asp?m=129600,2/5/2019,1/27/2022
129601,,"Royal East Kent Imperial Yeomanry Boer War Memorial",,,,,51.27542,1.07902,,"Canterbury",,"Kent","England","It can be reached from the intersection of Pin Hill and Castle Row, on the right when traveling west. ",,https://www.hmdb.org/m.asp?m=129601,2/5/2019,1/27/2022
129602,,"Dr. Frank Wagher Fountain",,,,,51.27519,1.07644,,"Canterbury",,"Kent","England","It can be reached from the intersection of Pin Hill and Castle Row, on the right when traveling west. ",,https://www.hmdb.org/m.asp?m=129602,2/5/2019,1/27/2022
129603,,"The Simmons Memorial",,,,,51.27492,1.07787,,"Canterbury",,"Kent","England","It can be reached from the intersection of Pin Hill and Castle Row, on the right when traveling west. ",,https://www.hmdb.org/m.asp?m=129603,2/5/2019,1/27/2022
129606,,"Wincheap Gate",,,,,51.27507,1.07579,,"Canterbury",,"Kent","England","It is on Pin Hill close to  Castle Row, on the right when traveling west. ",,https://www.hmdb.org/m.asp?m=129606,2/5/2019,1/27/2022
129607,,"Lamberhurst War Memorial",,,,,51.10334,0.39426,,"Lamberhurst",,"Kent","England","It is at the intersection of School Hill (England Route B2162) and Parsonage Lane, on the right when traveling north on School Hill. ",,https://www.hmdb.org/m.asp?m=129607,2/5/2019,1/27/2022
129609,,"Keymer and Clayton War Memorial",,,,,50.92178,-0.13091,,"Hassocks",,"West Sussex","England","It is at the intersection of Keymer Road and Lodge Lane, on the left when traveling west on Keymer Road. ",,https://www.hmdb.org/m.asp?m=129609,2/5/2019,1/27/2022
129611,,"Ditchling War Memorial",,,,,50.92152,-0.11716,,"Ditchling",,"West Sussex","England","It is at the intersection of West Street (England Route B2116) and Lodge Hill Lane, on the right when traveling west on West Street. ",,https://www.hmdb.org/m.asp?m=129611,2/5/2019,1/27/2022
129644,,"Battle of Lewes 1264",,,1985,,50.87412,0.00827,,"Lewes",,"East Sussex","England","It is at the intersection of Castle Banks and Castle Precints, on the right when traveling south on Castle Banks. ",,https://www.hmdb.org/m.asp?m=129644,2/7/2019,1/27/2022
129646,,"Battle of Lewes 14th May 1264",,,,,50.87412,0.00827,,"Lewes",,"East Sussex","England","It is at the intersection of Castle Banks and Castle Precints, on the right when traveling south on Castle Banks. ",,https://www.hmdb.org/m.asp?m=129646,2/7/2019,1/27/2022
129647,,"Barbican Gate",,,,,50.87282,0.00836,"92 High Street","Lewes",,"East Sussex","England","It can be reached from the intersection of High Street and Castle Gate, on the left when traveling east. ",,https://www.hmdb.org/m.asp?m=129647,2/7/2019,1/27/2022
129649,,"Lewes Market Tower",,,1981,,50.87372,0.01129,"18 Market Street","Lewes",,"East Sussex","England","It is on Market Street close to  High Street, on the left when traveling north. ",,https://www.hmdb.org/m.asp?m=129649,2/7/2019,1/27/2022
129650,,"Loyal Feeling for Queen Victoria",,,1887,,50.87372,0.01129,"18 Market Street","Lewes",,"East Sussex","England","It is on Market Street close to  High Street, on the left when traveling north. ",,https://www.hmdb.org/m.asp?m=129650,2/7/2019,1/27/2022
129651,,"Lewes War Memorial",,,,,50.87342,0.01111,,"Lewes",,"East Sussex","England","It is at the intersection of High Street and Market Street, on the left when traveling east on High Street. ",,https://www.hmdb.org/m.asp?m=129651,2/7/2019,1/27/2022
129652,,"Protestant Martyrs Prison","“Faithful Unto Death”",,,,50.87334,0.01079,"43A High St","Lewes",,"East Sussex","England","It is at the intersection of High Street and Fisher Street, on the left when traveling east on High Street. ",,https://www.hmdb.org/m.asp?m=129652,2/7/2019,2/16/2022
129653,,"Albion Russell",,,,,50.87322,0.01042,"187 High Street","Lewes",,"East Sussex","England","It is at the intersection of High Street and Fisher Street, on the left when traveling east on High Street. ",,https://www.hmdb.org/m.asp?m=129653,2/7/2019,1/27/2022
129662,,"Anchor",,,,,50.87278,0.00825,,"Lewes",,"East Sussex","England","It can be reached from the intersection of High Street and Castle Gate, on the left when traveling east. ",,https://www.hmdb.org/m.asp?m=129662,2/7/2019,1/27/2022
129663,,"Russian Cannon",,,,,50.87283,0.00804,,"Lewes",,"East Sussex","England","It can be reached from the intersection of High Street and Castle Gate, on the left when traveling east. ",,https://www.hmdb.org/m.asp?m=129663,2/7/2019,1/27/2022
129664,,"Stocks",,,,,50.87281,0.00828,,"Lewes",,"East Sussex","England","It can be reached from the intersection of High Street and Castle Gate, on the left when traveling east. ",,https://www.hmdb.org/m.asp?m=129664,2/7/2019,1/27/2022
129665,,"The Curtain Wall and Castle Moat",,,,,50.87292,0.00836,,"Lewes",,"East Sussex","England","It can be reached from the intersection of High Street and Castle Gate, on the left when traveling east. ",,https://www.hmdb.org/m.asp?m=129665,2/7/2019,1/27/2022
129666,,"The Shell Keep and Angled Towers",,,,,50.87297,0.00826,,"Lewes",,"East Sussex","England","It can be reached from the intersection of High Street and Castle Gate, on the left when traveling east. ",,https://www.hmdb.org/m.asp?m=129666,2/7/2019,1/27/2022
129687,,"The Norman Gatehouse and the Barbican",,,,,50.87289,0.00799,,"Lewes",,"East Sussex","England","It can be reached from the intersection of High Street and Castle Gate, on the left when traveling east. ",,https://www.hmdb.org/m.asp?m=129687,2/8/2019,1/27/2022
129688,,"Brack Mount",,,,,50.87286,0.00773,,"Lewes",,"East Sussex","England","It can be reached from the intersection of High Street and Castle Gate, on the left when traveling east. ",,https://www.hmdb.org/m.asp?m=129688,2/8/2019,1/27/2022
129689,,"The Battle of Lewes, 1264",,,,,50.87287,0.00766,,"Lewes",,"East Sussex","England","It can be reached from the intersection of High Street and Castle Gate, on the left when traveling east. ",,https://www.hmdb.org/m.asp?m=129689,2/8/2019,1/27/2022
129690,,"Fireplace",,,,,50.87279,0.00757,,"Lewes",,"East Sussex","England","It can be reached from the intersection of High Street and Castle Gate, on the left when traveling east. ",,https://www.hmdb.org/m.asp?m=129690,2/8/2019,1/27/2022
129694,,"What Happened Where?",,,,,50.87293,0.00770,,"Lewes",,"East Sussex","England","It can be reached from the intersection of High Street and Castle Gate, on the left when traveling east. ",,https://www.hmdb.org/m.asp?m=129694,2/8/2019,1/27/2022
129708,,"Lewes Prison",,,,,50.87275,0.00749,,"Lewes",,"East Sussex","England","It can be reached from the intersection of High Street and Castle Gate, on the left when traveling east. ",,https://www.hmdb.org/m.asp?m=129708,2/8/2019,1/27/2022
129709,,"St Michael’s Church",,,,,50.87274,0.00750,,"Lewes",,"East Sussex","England","It can be reached from the intersection of High Street and Castle Gate, on the left when traveling east. ",,https://www.hmdb.org/m.asp?m=129709,2/8/2019,1/27/2022
129710,,"Southover Grange",,,,,50.87273,0.00755,,"Lewes",,"East Sussex","England","It can be reached from the intersection of High Street and Castle Gate, on the left when traveling east. ",,https://www.hmdb.org/m.asp?m=129710,2/8/2019,1/27/2022
129711,,"Mount Caburn",,,,,50.87274,0.00757,,"Lewes",,"East Sussex","England","It can be reached from the intersection of High Street and Castle Gate, on the left when traveling east. ",,https://www.hmdb.org/m.asp?m=129711,2/8/2019,1/27/2022
129712,,"Protestant Martyrs",,,,,50.87276,0.00758,,"Lewes",,"East Sussex","England","It can be reached from the intersection of High Street and Castle Gate, on the left when traveling east. ",,https://www.hmdb.org/m.asp?m=129712,2/8/2019,1/27/2022
129713,,"The Wealds",,,,,50.87277,0.00757,,"Lewes",,"East Sussex","England","It can be reached from the intersection of High Street and Castle Gate, on the left when traveling east. ",,https://www.hmdb.org/m.asp?m=129713,2/8/2019,1/27/2022
129714,,"Lewes Racecourse",,,,,50.87276,0.00752,,"Lewes",,"East Sussex","England","It can be reached from High Street close to  Castle Gate, on the left when traveling east. ",,https://www.hmdb.org/m.asp?m=129714,2/8/2019,1/27/2022
129781,,"Borough of Lewes",,,1931,,50.87201,0.00680,"92 High Street","Lewes",,"East Sussex","England","It is at the intersection of High Street and Westgate Street, on the right when traveling east on High Street. ",,https://www.hmdb.org/m.asp?m=129781,2/10/2019,1/27/2022
129782,,"Thomas Paine House",,,,,50.87201,0.00681,"92 High Street","Lewes",,"East Sussex","England","It is at the intersection of High Street and Westgate Street, on the right when traveling east on High Street. ",,https://www.hmdb.org/m.asp?m=129782,2/10/2019,9/27/2023
129783,,"Bull House Westgate",,,,,50.87201,0.00684,"92 High Street","Lewes",,"East Sussex","England","It is at the intersection of High Street and Westgate Street, on the right when traveling east on High Street. ",,https://www.hmdb.org/m.asp?m=129783,2/10/2019,1/27/2022
129822,,"Dr. Gideon A. Mantell",,,,,50.87240,0.00799,"166 High Street","Lewes",,"East Sussex","England","It is at the intersection of High Street and Castle Gate, on the left when traveling east on High Street. ",,https://www.hmdb.org/m.asp?m=129822,2/11/2019,1/27/2022
129823,,"County Hall",,,,,50.87302,0.01000,,"Lewes",,"East Sussex","England","It is at the intersection of High Street and Fisher Street, on the left when traveling east on High Street. ",,https://www.hmdb.org/m.asp?m=129823,2/11/2019,1/27/2022
129824,,"Chennelsbrook Castle",,,,,51.08545,-0.30497,,"Horsham",,"West Sussex","England","It is at the intersection of Lemmington Way and Petworth Drive, on the right when traveling west on Lemmington Way. ",,https://www.hmdb.org/m.asp?m=129824,2/11/2019,1/27/2022
129825,,"Rusper War Memorial",,,,,51.12260,-0.27893,"5 High St","Rusper",,"West Sussex","England","It is at the intersection of High Street and Horsham Road, on the left when traveling north on High Street. ",,https://www.hmdb.org/m.asp?m=129825,2/11/2019,1/27/2022
129826,,"Newdigate War Memorial",,,,,51.16500,-0.28863,,"Newdigate",,"Surrey","England","It is at the intersection of Rusper Road and Church Road, on the right when traveling north on Rusper Road. ",,https://www.hmdb.org/m.asp?m=129826,2/11/2019,1/27/2022
129827,,"The City of London",,,,,51.29957,-0.13501,,"Coulsdon",,"Greater London","England","It is at the intersection of Ditches Lane and Drive Road, on the left when traveling north on Ditches Lane. ",,https://www.hmdb.org/m.asp?m=129827,2/11/2019,1/27/2022
129828,,"Open Spaces",,,,,51.29957,-0.13499,,"Coulsdon",,"Greater London","England","It is at the intersection of Ditches Lane and Drive Road, on the left when traveling north on Ditches Lane. ",,https://www.hmdb.org/m.asp?m=129828,2/11/2019,1/27/2022
129829,,"Chalk Grassland",,,,,51.29957,-0.13495,,"Coulsdon",,"Greater London","England","It is at the intersection of Ditches Lane and Drive Road, on the left when traveling north on Ditches Lane. ",,https://www.hmdb.org/m.asp?m=129829,2/11/2019,2/9/2023
129830,,"Early History",,,,,51.29956,-0.13493,,"Coulsdon",,"Greater London","England","It is at the intersection of Ditches Lane and Drive Road, on the left when traveling north on Ditches Lane. ",,https://www.hmdb.org/m.asp?m=129830,2/11/2019,1/27/2022
129831,,"Recent History",,,,,51.29954,-0.13491,,"Coulsdon",,"Greater London","England","It is at the intersection of Ditches Lane and Drive Road, on the left when traveling north on Ditches Lane. ",,https://www.hmdb.org/m.asp?m=129831,2/11/2019,1/27/2022
130043,,"London Hop Trade World War I Memorial",,,,,51.50432,-0.09078,"32-34 Borough High Street","Southwark",,"Greater London","England","It is at the intersection of Borough High Street and Talbot Yard, on the left when traveling north on Borough High Street. ",,https://www.hmdb.org/m.asp?m=130043,2/17/2019,1/27/2022
130044,,"Royal Exchange Jubilee Walkway",,,,,51.51350,-0.08828,,"City of London",,"Greater London","England","It is at the intersection of Cornhill and Threadneedle Street, on the right when traveling west on Cornhill. ",,https://www.hmdb.org/m.asp?m=130044,2/17/2019,1/27/2022
130045,,"West India Docks",,,,,51.50776,-0.02463,"4 Hertsmere Road","Tower Hamlets",,"Greater London","England","It is on Ontario Way close to  Hertsmere Road, on the left when traveling east. ",,https://www.hmdb.org/m.asp?m=130045,2/17/2019,1/27/2022
130176,,"Bloomsbury Square",,,,,51.51880,-0.12326,,"Camden",,"Greater London","England","It is at the intersection of Bloomsbury Square and Bloomsbury Way, on the right when traveling north on Bloomsbury Square. ",,https://www.hmdb.org/m.asp?m=130176,2/21/2019,1/27/2022
130177,,"Bloomsbury Square Physic Garden",,,,,51.51871,-0.12311,,"Camden",,"Greater London","England","It is at the intersection of Bloomsbury Square and Bloomsbury Way, on the right when traveling north on Bloomsbury Square. ",,https://www.hmdb.org/m.asp?m=130177,2/21/2019,1/27/2022
130262,,"Dorking War Memorial",,,,,51.23065,-0.33415,,"Dorking",,"Surrey","England","It is at the intersection of South Street (England Route A25) and Junction Road, on the right when traveling north on South Street. ",,https://www.hmdb.org/m.asp?m=130262,2/24/2019,1/27/2022
130433,,"Orangery Project","The Kensington Palace Pavilion",,,,51.50588,-0.18702,,"Kensington and Chelsea",,"Greater London","England","It can be reached from the intersection of Bayswater Road and Kensington Palace Gardens, on the left when traveling west. ",,https://www.hmdb.org/m.asp?m=130433,2/28/2019,5/8/2024
130441,,"York Watergate",,"Victoria Embankment Gardens",,,51.50802,-0.12296,,"City of Westminster",,"Greater London","England","It can be reached from the intersection of Victoria Embankment and Northumberland Avenue, on the left when traveling north. ",,https://www.hmdb.org/m.asp?m=130441,3/1/2019,1/27/2022
130816,,"Hythe Bridge Street",,,,,51.75342,-1.26516,,"Oxford",,"Oxfordshire","England","It is at the intersection of Hythe Bridge Street and Upper Fisher Row, on the right when traveling east on Hythe Bridge Street. ",,https://www.hmdb.org/m.asp?m=130816,3/8/2019,1/27/2022
130817,,"Cornmarket & Market St",,,,,51.75279,-1.25811,,"Oxford",,"Oxfordshire","England","It is at the intersection of Cornmarket Street and Market Street, on the left when traveling south on Cornmarket Street. ",,https://www.hmdb.org/m.asp?m=130817,3/8/2019,1/27/2022
130820,,"Christ Church & Its Meadow",,,,,51.74912,-1.25657,,"Oxford",,"Oxfordshire","England","It is at the intersection of St Aldate’s (England Route A420) and Rose Place, on the right when traveling north on St Aldate’s. ",,https://www.hmdb.org/m.asp?m=130820,3/8/2019,1/27/2022
131297,,"The Porter’s Garden",,,,,50.79916,-1.10714,,"Portsmouth",,"Portsmouth","England","It can be reached from the intersection of Queen Street and Wickham Street, on the left when traveling north. ",,https://www.hmdb.org/m.asp?m=131297,3/22/2019,1/27/2022
131298,,"The Plain & Magdalen Bridge",,,,,51.74986,-1.24424,,"Oxford",,"Oxfordshire","England","It is at the intersection of Cowley Place and The Plain, on the right when traveling north on Cowley Place. ",,https://www.hmdb.org/m.asp?m=131298,3/22/2019,1/27/2022
131964,,"The Trinity House","Incorporated by Charter Granted by Henry VIII in 1514",,,,51.51032,-0.07707,"Trinity Square","City of London",,"Greater London","England","",,https://www.hmdb.org/m.asp?m=131964,4/10/2019,1/27/2022
132007,,"The Great Fire of Tooley Street",,,,"Hay's Galleria, London Bridge City",51.50506,-0.08392,,"Southwark",,"Greater London","England","It is at the intersection of Battle Bridge Lane and Tooley Street ( Route A200), on the right when traveling south on Battle Bridge Lane. ",,https://www.hmdb.org/m.asp?m=132007,4/11/2019,3/23/2025
132009,,"Hay's Wharf",,,,"Hay's Galleria, London Bridge City",51.50546,-0.08485,,"Southwark",,"Greater London","England","It is at the intersection of Hay's Lane and Tooley Street (Route A200), on the right when traveling south on Hay's Lane. ",,https://www.hmdb.org/m.asp?m=132009,4/11/2019,9/12/2024
132010,,"The Church of St. Olave",,,,,51.50622,-0.08646,,"Southwark",,"Greater London","England","It is at the intersection of Tooley Street (England Route A200) and Bridge Yard, on the right when traveling west on Tooley Street. ",,https://www.hmdb.org/m.asp?m=132010,4/11/2019,1/27/2022
132012,,"Charles Stewart Rolls",,,,,51.12360,1.31693,,"Dover",,"Kent","England","It is at the intersection of Marine Parade and Wellesley Road, on the right when traveling west on Marine Parade. ",,https://www.hmdb.org/m.asp?m=132012,4/11/2019,1/27/2022
132015,,"The Royal Norwegian Navy",,,1998,,51.12390,1.31773,,"Dover",,"Kent","England","It is on Marine Parade just east of Wellesley Road, on the right when traveling west. ",,https://www.hmdb.org/m.asp?m=132015,4/11/2019,1/27/2022
132017,,"Capt Matthew Webb",,,1910,"Public Subscription",51.12424,1.31862,,"Dover",,"Kent","England","It is on Marine Parade just east of Wellesley Road, on the right when traveling west. ",,https://www.hmdb.org/m.asp?m=132017,4/11/2019,1/27/2022
132019,,"Francis Barraud",,,,"British Plaque Trust",51.50431,-0.14799,,"City of Westminster",,"Greater London","England","It can be reached from Piccadilly (England Route A4) just west of Down Street. ",,https://www.hmdb.org/m.asp?m=132019,4/11/2019,1/27/2022
132030,,"Major Alexander William Hewetson",,,,,51.18272,-1.83978,,"Salisbury",,"Wiltshire","England","",,https://www.hmdb.org/m.asp?m=132030,4/12/2019,1/27/2022
132492,,"Operation Fuller","""The Channel Dash""","12th February 1942",,,51.12393,1.31794,,"Dover",,"Kent","England","It is on Marine Parade just east of Wellesley Road, on the right when traveling west. ",,https://www.hmdb.org/m.asp?m=132492,4/20/2019,12/9/2022
135421,,"Globe Theatre",,,1909,"Shakespeare Reading Society of London",51.50696,-0.09458,,"Southwark",,"Greater London","England","It is on Parl Street just west of Porter Street, on the right when traveling east. ",,https://www.hmdb.org/m.asp?m=135421,6/18/2019,1/27/2022
142702,,"Birth Of Radar Memorial",,,2001,"QinetiQ Ltd. and Mrs. Nancy Wilson",52.19598,-1.05009,,"Upper Stowe",,"Northamptonshire","England","It is on Litchboro Northampton Road just west of A5, on the left when traveling east. ",,https://www.hmdb.org/m.asp?m=142702,11/22/2019,1/27/2022
145179,,"Thomas Gainsborough",,,1951,"London County Council",51.50583,-0.13599,"82 Pall Mall","City of Westminster",,"Greater London","England","It is on Pall Mall, on the left when traveling west. ",,https://www.hmdb.org/m.asp?m=145179,2/5/2020,1/27/2022
145183,,"Broad Street Pump",,,,,51.51330,-0.13669,"39 Broadwick Street","City of Westminster",,"Greater London","England","It is at the intersection of Broadwick Street and Lexington Street, on the right when traveling east on Broadwick Street. ",,https://www.hmdb.org/m.asp?m=145183,2/5/2020,1/27/2022
145193,,"Sir Morell MacKenzie",,,1995,"Westminster City Council, Royal Society of Medicine",51.51186,-0.13768,"33 Golden Square","City of Westminster",,"Greater London","England","It is on Golden Square, on the right when traveling west. ",,https://www.hmdb.org/m.asp?m=145193,2/6/2020,1/27/2022
145194,,"Dr. John Snow","National Chemical Landmark",,2008,"Royal Society of Chemistry",51.51330,-0.13667,"39 Broadwick Street","City of Westminster",,"Greater London","England","It is on Broadwick Street. ",,https://www.hmdb.org/m.asp?m=145194,2/6/2020,1/27/2022
145205,,"Rabindranath Tagore","(1861 - 1941)",,2011,"Tagore Centre UK",51.52411,-0.13096,,"Camden",,"Greater London","England","It can be reached from Gordon Square. ",,https://www.hmdb.org/m.asp?m=145205,2/7/2020,1/27/2022
145208,,"Dr. Williams's Library",,,,,51.52405,-0.13149,"14 Gordon Square","Camden",,"Greater London","England","It is on Gordon Square, on the left when traveling north. ",,https://www.hmdb.org/m.asp?m=145208,2/7/2020,1/27/2022
145211,,"Cooks Hall",,,,,51.51699,-0.09673,"10 Aldersgate Road","City of London",,"Greater London","England","It is at the intersection of Aldersgate Road and Little Britain on Aldersgate Road. ",,https://www.hmdb.org/m.asp?m=145211,2/7/2020,12/7/2024
145213,,"The Conversions of the Revs. John and Charles Wesley",,,1926,"International Methodist Historical Union",51.51689,-0.09697,,"City of London",,"Greater London","England","It is on Aldersgate just south of Little Britain, on the left when traveling north. ",,https://www.hmdb.org/m.asp?m=145213,2/7/2020,1/27/2022
145214,,"The Club",,,,"City of Westminster, Honsway C&E Foundation",51.51199,-0.13071,"9 Gerrard Street","City of Westminster",,"Greater London","England","It is on Gerrard Street just east of Dean Street. ",,https://www.hmdb.org/m.asp?m=145214,2/7/2020,1/27/2022
145215,,"Penny Post",,,2008,"City of Westminster",51.51187,-0.13070,"39 Gerrard Street","City of Westminster",,"Greater London","England","It is on Gerrard Street, on the right when traveling east. ",,https://www.hmdb.org/m.asp?m=145215,2/7/2020,1/27/2022
147186,,"Justice Tree",,,,"City of Rochester",51.38879,0.50158,,"Rochester",,"Medway","England","It is on Boley Hill, on the right when traveling west. ",,https://www.hmdb.org/m.asp?m=147186,4/1/2020,1/27/2022
147189,,"Site of the Saxon Cathedral",,,,"City of Rochester",51.38927,0.50267,,"Rochester",,"Medway","England","It can be reached from Boley Hill. ",,https://www.hmdb.org/m.asp?m=147189,4/1/2020,1/27/2022
147191,,"Abdication House",,,,,51.38953,0.50395,,"Rochester",,"Medway","England","It is on High Street, on the left when traveling south. ",,https://www.hmdb.org/m.asp?m=147191,4/1/2020,7/1/2024
147193,,"Restoration House",,,,,51.38633,0.50434,,"Rochester",,"Medway","England","It is on Crow Lane, on the right when traveling north. ",,https://www.hmdb.org/m.asp?m=147193,4/1/2020,1/15/2024
147821,,"The Vines",,,,"City of Rochester",51.38728,0.50256,,"Rochester",,"Medway","England","It can be reached from Vines Lane. ",,https://www.hmdb.org/m.asp?m=147821,4/20/2020,1/27/2022
147927,,"Site of Henry III Gate",,,,"City of Rochester",51.38856,0.50194,,"Rochester",,"Medway","England","It is on St. Margaret's Street, on the left when traveling south. ",,https://www.hmdb.org/m.asp?m=147927,4/20/2020,1/27/2022
150777,,"Rochester Castle Moat",,,,"City of Rochester",51.38954,0.50264,,"Rochester",,"Medway","England","It is on Boley Hill just east of St. Margaret's Street, on the left when traveling east. ",,https://www.hmdb.org/m.asp?m=150777,6/1/2020,1/27/2022
150831,,"Dame Sybil Thorndike",,,,,51.38939,0.50284,,"Rochester",,"Medway","England","It is on Minor Canon Row, on the left when traveling east. ",,https://www.hmdb.org/m.asp?m=150831,6/2/2020,3/2/2025
152840,,"Eastgate House",,,,"City of Rochester",51.38712,0.50616,"High Street, Rochedtet, Kent, ME1 1ER","Rochester",,"Medway","England","It is on High Street, on the left when traveling east. ",,https://www.hmdb.org/m.asp?m=152840,7/15/2020,2/4/2024
152845,,"Mr. Sapsea's House",,,,"City of Rochester",51.38709,0.50580,"150a High St, Rochester ME1 1ER","Rochester",,"Medway","England","It is on High Street when traveling east. ",,https://www.hmdb.org/m.asp?m=152845,7/15/2020,1/27/2022
154430,,"Code Breaking at Bletchley Park during World War II, 1939-1945","IEEE Milestone In Electrical Engineering and Computing",,2003,"Institute of Electrical and Electronics Engineers",51.99653,-0.74282,,"Milton Keynes",,"Milton Keynes","England","It can be reached from Sherwood Drive close to  Jemima Way, on the left when traveling north. ",,https://www.hmdb.org/m.asp?m=154430,8/9/2020,1/27/2022
155012,,"Sir Arthur Quiller Couch House",,,1963,,50.47122,-4.71802,"17-19 Honey Street","Bodmin",,"Cornwall","England","It is at the intersection of Turf Street and Honey Street, on the left when traveling north on Turf Street. ",,https://www.hmdb.org/m.asp?m=155012,8/21/2020,1/27/2022
155013,,"St Oswald's Anglo Saxon Minster and Medieval Priory",,,,"Gloucester City Council",51.86948,-2.24768,,"Gloucester",,"Gloucestershire","England","It is on Archdeacon Street, on the left when traveling east. ",,https://www.hmdb.org/m.asp?m=155013,8/19/2020,1/27/2022
