MarkerID,Marker No.,Title,Subtitle,Add'l Subtitle,Year Erected,Erected By,Latitude (minus=S),Longitude (minus=W),Street Address,City or Town,Section or Quarter,County or Parish,State or Prov.,Location,Missing,Link,First Published,Last Update
181241,,"Why?","Sand Creek Massacre National Historic Site",,,"National Park Service",38.54937,-102.51182,,"Eads",,"Kiowa County","Colorado","It is on County Road W, 1.3 miles east of County Road 54. <font color=red> Reported permanently removed.</font>",Reported Missing,https://www.hmdb.org/m.asp?m=181241,9/10/2021,9/10/2021
181242,,"The Attack",,,,"National Park Service",38.54806,-102.50850,,"Eads",,"Kiowa County","Colorado","It can be reached from County Road W, 1.3 miles east of County Road 54. <font color=red> Reported permanently removed.</font>",Reported Missing,https://www.hmdb.org/m.asp?m=181242,9/7/2021,9/7/2021
181243,,"Pleas for Peace","Sand Creek Massacre National Historic Site",,,"National Park Service",38.54940,-102.51179,,"Eads",,"Kiowa County","Colorado","It can be reached from County Road W, 1.3 miles east of County Road 54. <font color=red> Reported permanently removed.</font>",Confirmed Missing,https://www.hmdb.org/m.asp?m=181243,9/8/2021,9/8/2021
181252,,"Chaos, Disorder, and Disgust",,,,"National Park Service",38.55764,-102.52507,,"Chivington",,"Kiowa County","Colorado","It can be reached from County Highway W east of Chief White Antelope Way. ",,https://www.hmdb.org/m.asp?m=181252,9/8/2021,9/8/2021
181254,,"The Largest Tracksite in North America",,,,"US Forest Service",37.61985,-103.59930,,"Kim",,"Las Animas County","Colorado","",,https://www.hmdb.org/m.asp?m=181254,9/8/2021,9/8/2021
181477,,"Incredible Feats of Bravery",,,,"National Park Service",38.55764,-102.52509,,"Chivington",,"Kiowa County","Colorado","It can be reached from County Highway W east of Chief White Antelope Way. ",,https://www.hmdb.org/m.asp?m=181477,9/11/2021,9/11/2021
181575,,"Troops Approach the Village",,,,"National Park Service",38.55325,-102.51623,,"Chivington",,"Kiowa County","Colorado","It can be reached from County Highway W east of Chief White Antelope Way. ",,https://www.hmdb.org/m.asp?m=181575,9/11/2021,9/11/2021
181871,,"A Vital Link",,,,"The Semmens Family; Santa Fe Trail Association; National Park Service",38.09369,-102.75996,,"Wiley",,"Prowers County","Colorado","It can be reached from County Highway 35.25 south of County Highway JJ. ",,https://www.hmdb.org/m.asp?m=181871,9/17/2021,9/17/2021
181873,,"Conflict Within and Without",,,,,38.55636,-102.52011,,"Chivington",,"Kiowa County","Colorado","It can be reached from County Highway W east of Chief White Antelope Way. ",,https://www.hmdb.org/m.asp?m=181873,9/17/2021,9/17/2021
181884,,"History of the Rourke Family and Wineglass Ranch, 1871-1900",,,,"Forest Service, U.S. Department of Agriculture",37.59408,-103.63882,,"Kim",,"Las Animas County","Colorado","It can be reached from Forest Road 2185 east of Rourke Road (County Highway 25). ",,https://www.hmdb.org/m.asp?m=181884,9/17/2021,12/24/2024
181887,,"A Chief’s Village",,,,"National Park Service",38.54953,-102.51167,,"Chivington",,"Kiowa County","Colorado","It can be reached from County Highway W east of Chief White Antelope Way. ",,https://www.hmdb.org/m.asp?m=181887,9/22/2021,9/22/2021
181944,,"Welcome to the Sand Creek Massacre National Historic Site",,,,"National Park Service, U.S. Department of the Interior",38.54467,-102.50430,,"Chivington",,"Kiowa County","Colorado","It is on Unnamed entrance road north of County Road W, in the median. ",,https://www.hmdb.org/m.asp?m=181944,9/24/2021,11/28/2021
181947,,"Rourke Ranch Historic District 1900-1971","<i> Architecture Reflects Interaction of Ethnic Settlers </i>",,,"US Forest Service",37.59411,-103.63882,,"Kim",,"Las Animas County","Colorado","It can be reached from Forest Road 2185 east of Rourke Road (County Highway 25). ",,https://www.hmdb.org/m.asp?m=181947,9/17/2021,9/17/2021
182057,,"""The Green Dragon""","Armored Personnel carrier M113",,,,38.43383,-105.10381,,"Penrose",,"Fremont County","Colorado","It is on Decker Drive, 0.2 miles east of Airport Drive, on the left when traveling south. ",,https://www.hmdb.org/m.asp?m=182057,9/22/2021,9/22/2021
182105,,"Alfred G. Packer",,,2016,"Al Packer Chapter #100 Ancient & Honorable Order of E Clampus Vitus",39.60517,-105.01658,"6155 S Prince Street","Littleton",,"Arapahoe County","Colorado","It can be reached from South Prince Street. ",,https://www.hmdb.org/m.asp?m=182105,9/22/2021,6/3/2024
182290,,"Attack and Pursuit",,,,"National Park Service",38.55326,-102.51624,,"Chivington",,"Kiowa County","Colorado","It can be reached from County Highway W east of Chief White Antelope Way. ",,https://www.hmdb.org/m.asp?m=182290,9/22/2021,9/22/2021
182455,,"Dolores Mission and Cemetery",,,,"Forest Service, U.S. Department of Agriculture",37.63644,-103.58535,,"Kim",,"Las Animas County","Colorado","It can be reached from Forest Road 2185 east of Rourke Road (County Highway 25). ",,https://www.hmdb.org/m.asp?m=182455,9/25/2021,12/24/2024
184919,,"Dinosaur Shoulder Blade From An Apatosaurus",,,,"US Forest Service, Department of Agriculture",37.62456,-103.59309,,"Kim",,"Las Animas County","Colorado","It can be reached from Forest Road 2185 east of Rourke Road (County Highway 25). ",,https://www.hmdb.org/m.asp?m=184919,11/1/2021,11/1/2021
184923,,"Incriminations and Culpability",,,,"National Park Service, Department of the Interior",38.56016,-102.52687,,"Chivington",,"Kiowa County","Colorado","It can be reached from County Highway W east of Chief White Antelope Way. ",,https://www.hmdb.org/m.asp?m=184923,11/4/2021,11/4/2021
184925,,"Why A 33 Star Flag",,,,"National Park Service, Department of the Interior",38.54446,-102.50370,,"Chivington",,"Kiowa County","Colorado","It can be reached from County Highway W east of Chief White Antelope Way. ",,https://www.hmdb.org/m.asp?m=184925,11/4/2021,11/4/2021
185030,,"Tragedy and Restoration",,,,"Santa Fe Trail Association; National Park Service; Semmens Family",38.09422,-102.75785,,"Wiley",,"Prowers County","Colorado","It is on County Highway 35.25 south of County Highway JJ. ",,https://www.hmdb.org/m.asp?m=185030,11/4/2021,11/4/2021
185037,,"Humans and the Prairie",,,,"National Park Service, Department of the Interior",38.54450,-102.50366,,"Chivington",,"Kiowa County","Colorado","It can be reached from County Highway W east of Chief White Antelope Way. ",,https://www.hmdb.org/m.asp?m=185037,11/4/2021,11/4/2021
185412,,"Welcome to the Crags Hotel","1908 - 1912",,,,39.92674,-105.29484,"321 Eldorado Springs Drive","Eldorado Springs",,"Boulder County","Colorado","It can be reached from Rattlesnake Gulch Trail. ",,https://www.hmdb.org/m.asp?m=185412,11/10/2021,3/23/2025
186903,,"San Juan Travel",,,2003,"Colorado Historical Society and Colorado Department of Transportation",38.01667,-107.67082,,"Ouray",,"Ouray County","Colorado","It is on Million Dollar Highway (U.S. 550) 0.1 miles south of County Highway 16, on the left when traveling north. ",,https://www.hmdb.org/m.asp?m=186903,11/27/2021,11/27/2021
186905,,"Preserving the Past",,,2003,"Colorado Historical Society and Colorado Department of Transportation",38.01669,-107.67080,,"Ouray",,"Ouray County","Colorado","It is on Million Dollar Highway (U.S. 550) 0.1 miles south of County Highway 16, on the left when traveling north. ",,https://www.hmdb.org/m.asp?m=186905,11/27/2021,11/27/2021
186909,,"Untold Stories",,,2003,"Colorado Historical Society and Colorado Department of Transportation",38.01669,-107.67083,,"Ouray",,"Ouray County","Colorado","It is on Million Dollar Highway (U.S. 550) 0.1 miles south of County Highway 16, on the left when traveling north. ",,https://www.hmdb.org/m.asp?m=186909,11/27/2021,11/27/2021
186918,,"Ouray Elks Lodge",,,,"Ouray County Historical Society",38.02118,-107.67130,"421 Main Street","Ouray",,"Ouray County","Colorado","It is on Main Street (U.S. 550) 0.1 miles south of 5th Avenue, on the right when traveling north. ",,https://www.hmdb.org/m.asp?m=186918,11/27/2021,11/27/2021
186920,,"Beaumont Restoration",,,,"Dan and Mary King",38.02179,-107.67130,"505 Main Street","Ouray",,"Ouray County","Colorado","It is at the intersection of Main Street (U.S. 550) and 5th Avenue, on the right when traveling north on Main Street. ",,https://www.hmdb.org/m.asp?m=186920,11/27/2021,11/27/2021
186922,,"The Hangin' Tree","August 9, 1878",,,"Hangin' Tree RV Park",38.43279,-107.86548,"17250 US 550","Montrose",,"Montrose County","Colorado","It is on U.S. 550, 0.1 miles south of Chipeta Road, on the right when traveling north. ",,https://www.hmdb.org/m.asp?m=186922,11/27/2021,11/28/2024
186957,,"The Ute Way of Life","Living in Harmony with Nature",,,"History Colorado and Ute Indian Museum",38.43557,-107.86769,"17253 Chipeta Road","Montrose",,"Montrose County","Colorado","It is at the intersection of Chipeta Road and U.S. 550, on the right when traveling north on Chipeta Road. ",,https://www.hmdb.org/m.asp?m=186957,11/28/2021,11/28/2021
186965,,"West Elk Loop","Scenic and Historic Byway",,,"Colorado Department of Transportation and Scenic Byways",38.79646,-107.71128,,"Hotchkiss",,"Delta County","Colorado","It is at the intersection of County Highway 92 and Doc Maloney Way, on the right when traveling south on County Highway 92. ",,https://www.hmdb.org/m.asp?m=186965,11/28/2021,11/28/2021
187003,,"Storage Units","Upper Colorado River Storage Project",,,"U.S. Department of the Interior - Bureau of Reclamation",38.45264,-107.34322,,"Gunnison",,"Gunnison County","Colorado","It is on State Highway 92, ¼ mile Blue Mesa Drive (County Highway 721), on the right when traveling east. ",,https://www.hmdb.org/m.asp?m=187003,11/28/2021,11/28/2021
187024,,"Pueblo West Veterans Memorial",,,1994,"VFW Post 5812 and Big John Landscaping",38.32622,-104.74130,,"Pueblo West",,"Pueblo County","Colorado","It is on McCulloch Boulevard, 0.1 miles north of South Joe Martinez Boulevard, on the left when traveling south. ",,https://www.hmdb.org/m.asp?m=187024,11/28/2021,11/28/2021
187029,,"Cuerno Verde","Colorado",,,"Colorado Historical Society and Colorado Department of Transportation",37.96361,-104.79709,,"Colorado City",,"Pueblo County","Colorado","It can be reached from the intersection of State Highway 165 and Interstate 25. ",,https://www.hmdb.org/m.asp?m=187029,11/28/2021,12/15/2021
188267,,"The Story Beneath Your Feet","Colorado",,,"Colorado Historical Society and Colorado Department of Transportation",37.96368,-104.79692,,"Colorado City",,"Pueblo County","Colorado","It can be reached from the intersection of State Highway 165 and CanAm Highway (Interstate 25). ",,https://www.hmdb.org/m.asp?m=188267,12/15/2021,12/15/2021
188275,,"Santa Fe and Taos Trails",,,,"Colorado Historical Society and Colorado Department of Transportation",37.96380,-104.79688,,"Colorado City",,"Pueblo County","Colorado","It can be reached from the intersection of Highway 165 and CanAm Highway (Interstate 25). ",,https://www.hmdb.org/m.asp?m=188275,12/16/2021,12/16/2021
188327,,"The Civil War in the Southwest","Colorado",,,"Colorado Historical Society and Colorado Department of Transportation",37.96365,-104.79721,,"Colorado City",,"Pueblo County","Colorado","It can be reached from the intersection of State Highway 165 and CanAm Highway (Interstate 25). ",,https://www.hmdb.org/m.asp?m=188327,12/16/2021,12/16/2021
188717,,"Trinidad: A Place to Explore and Discover… Create and Recreate..... Innovate and Invent",,,,"Colorado Department of Transportation",37.00757,-104.47971,,"Trinidad",,"Las Animas County","Colorado","It is on Interstate 25, 8 miles State Route 72, on the right. ",,https://www.hmdb.org/m.asp?m=188717,12/25/2021,12/25/2021
189636,,"Greenhorn Creek Bridge","The unusual bridge offered a window to travel on one of Colorado's earliest highways",,,,37.93444,-104.85388,,"Colorado City",,"Pueblo County","Colorado","It is on State Highway 181 south of State Highway 165, on the left. ",,https://www.hmdb.org/m.asp?m=189636,1/7/2022,3/12/2023
191017,,"Linwood Cemetery","Glenwood's Pioneer Cemetery",,,"Frontier Historical Society",39.54136,-107.32164,,"Glenwood Springs",,"Garfield County","Colorado","It is on Bennett Avenue south of 12th Street, on the right when traveling north. ",,https://www.hmdb.org/m.asp?m=191017,2/4/2022,2/4/2022
191234,,"Potter's Field",,,,"Frontier Historical Society",39.53955,-107.32046,"1398 Bennett Ave","Glenwood Springs",,"Garfield County","Colorado","It can be reached from Bennett Avenue south of 12th Street. ",,https://www.hmdb.org/m.asp?m=191234,2/4/2022,2/4/2022
191376,,"It's Our Fault",,,,"Box Canon Park",38.01830,-107.67815,"30 Box Canyon Road","Ouray",,"Ouray County","Colorado","It can be reached from Box Canyon Road south of 3rd Avenue. ",,https://www.hmdb.org/m.asp?m=191376,2/4/2022,2/4/2022
191749,,"Transportation on the Santa Fe Trail",,,,"Santa Fe Trail Scenic & Historic Byway - The Mountain Branch",37.22528,-104.49415,,"Trinidad",,"Las Animas County","Colorado","It is at the intersection of El Moro Road and County Highway 71.1 on El Moro Road. ",,https://www.hmdb.org/m.asp?m=191749,2/8/2022,2/8/2022
191922,,"A Babel-Tongued Multitude",,"Bent's Old Fort National Historic Site",,"National Park Service",38.04362,-103.43155,"35110 CO-194","La Junta",,"Otero County","Colorado","It is on Colorado 194 south of State Highway 194. ",,https://www.hmdb.org/m.asp?m=191922,2/12/2022,2/12/2022
192001,,"No Fur, No Fort","Bent's Old Fort National Historic Site",,,"National Park Service, U.S. Department of the Interior",38.04360,-103.43158,"35110 CO-194","La Junta",,"Otero County","Colorado","It can be reached from State Highway 194, 0.1 miles east of County Road 35, on the right when traveling east. ",,https://www.hmdb.org/m.asp?m=192001,2/17/2022,6/16/2024
192004,,"Bent's Fort on Santa Fe Trail",,,1910,"Daughters of the American Revolution",38.04612,-103.43080,"35273 CO-194","La Junta",,"Otero County","Colorado","It is on Colorado 194, 0.1 miles east of County Road 35, on the right when traveling east. ",,https://www.hmdb.org/m.asp?m=192004,2/17/2022,2/17/2022
193126,,"Chamber Celebrates Centennial","1907-2007",,2007,"Steamboat Springs Chamber of Commerce",40.48450,-106.83148,"522 Lincoln Avenue","Steamboat Springs",,"Routt County","Colorado","It is on Lincoln Avenue (U.S. 40) just west of 5th Street, on the right when traveling west. ",,https://www.hmdb.org/m.asp?m=193126,3/6/2022,4/28/2022
193556,,"Legacy",,,,"UMWA Local 9856 Women's Auxiliary",37.33914,-104.58388,,"Ludlow",,"Las Animas County","Colorado","It is at the intersection of County Highway 44 and County Highway 61.5, on the right when traveling west on County Highway 44. ",,https://www.hmdb.org/m.asp?m=193556,3/15/2022,3/15/2022
193557,,"History Revealed",,,,"UMWA Local 9856 Women's Auxiliary",37.33914,-104.58385,,"Ludlow",,"Las Animas County","Colorado","It is at the intersection of County Highway 44 and County Highway 61.5, on the right when traveling west on County Highway 44. ",,https://www.hmdb.org/m.asp?m=193557,3/15/2022,3/15/2022
193558,,"Rediscovering Ludlow","Archaeologists uncovered the original tent colony",,,"UMWA Local 9856 Women's Auxiliary",37.33915,-104.58384,,"Ludlow",,"Las Animas County","Colorado","It is at the intersection of County Highway 44 and County Highway 61.5, on the right when traveling west on County Highway 44. ",,https://www.hmdb.org/m.asp?m=193558,3/15/2022,3/15/2022
193570,,"Testimonies & Memories","Voices from the Budow Massacre survive.",,,"UMWA Local 9856 Women's Auxiliary",37.33915,-104.58383,,"Ludlow",,"Las Animas County","Colorado","It is at the intersection of County Highway 44 and County Highway 61.5, on the right when traveling west on County Highway 44. ",,https://www.hmdb.org/m.asp?m=193570,3/15/2022,3/15/2022
193590,,"United Mine Workers of America","UMWA",,,"UMWA Local 9856 Women's Auxiliary",37.33916,-104.58383,,"Ludlow",,"Las Animas County","Colorado","It is at the intersection of County Highway 44 and County Highway 61.5, on the right when traveling west on County Highway 44. ",,https://www.hmdb.org/m.asp?m=193590,3/15/2022,3/15/2022
193627,,"Tent Life",,,,"UMWA Local 9856 Women's Auxiliary",37.33918,-104.58382,,"Ludlow",,"Las Animas County","Colorado","It is at the intersection of County Highway 44 and County Highway 61.5, on the right when traveling west on County Highway 44. ",,https://www.hmdb.org/m.asp?m=193627,3/15/2022,3/15/2022
193636,,"Company Towns",,,,"UMWA Local 9856 Women's Auxiliary",37.33921,-104.58383,,"Ludlow",,"Las Animas County","Colorado","It is at the intersection of County Highway 44 and County Highway 61.5, on the right when traveling west on County Highway 44. ",,https://www.hmdb.org/m.asp?m=193636,3/15/2022,3/15/2022
193668,,"The Story",,,,"UMWA Local 9856 Women's Auxiliary",37.33923,-104.58384,,"Ludlow",,"Las Animas County","Colorado","It is at the intersection of County Highway 44 and County Highway 61.5, on the right when traveling west on County Highway 44. ",,https://www.hmdb.org/m.asp?m=193668,3/15/2022,3/15/2022
199337,,"Site of Burlington, Colorado Territory","First Town on the St. Vrain, 1860 - 1871.",,1985,"St. Vrain Historical Society, Inc.",40.15492,-105.10344,,"Longmont",,"Boulder County","Colorado","It is on Delaware Avenue, 0 miles east of South Coffman Street, on the right when traveling west. ",,https://www.hmdb.org/m.asp?m=199337,6/7/2022,6/7/2022
199427,,"The Elephant Corral","The Lower Downtown Walking Tour","1902",,"Lower Downtown Historic District.",39.74975,-105.00182,"1444 Wazee St","Denver","Central","Denver County","Colorado","It is on Wazee Street, 0.1 miles south of 15th Street, on the left when traveling south. ",,https://www.hmdb.org/m.asp?m=199427,6/11/2022,8/26/2024
199594,,"Ridgway Railroad Museum","The Rio Grande Southern Railroad",,2012,"E Clampus Vitus Al Packer Chapter 100 Colorado",38.15300,-107.75450,"421 North Railroad Street","Ridgway",,"Ouray County","Colorado","It can be reached from State Highway 62. ",,https://www.hmdb.org/m.asp?m=199594,6/11/2022,6/11/2022
199956,,"Indian Wars 1864-1869",,,1998,"Colorado Historical Society and Colorado Department of Transportation",40.15896,-103.21724,"425 W 1st St","Akron",,"Washington County","Colorado","It is at the intersection of West 1st Street (U.S. 34) and Custer Avenue, on the left when traveling west on West 1st Street. ",,https://www.hmdb.org/m.asp?m=199956,6/15/2022,3/4/2024
199981,,"Akron",,,1998,"Colorado Historical Society and Colorado Department of Transportation",40.15897,-103.21725,"425 W 1st St","Akron",,"Washington County","Colorado","It is at the intersection of West 1st Street and Custer Avenue, on the left when traveling west on West 1st Street. ",,https://www.hmdb.org/m.asp?m=199981,6/15/2022,3/4/2024
199982,,"Last Days of the Buffalo / Akron Country",,,1998,"Colorado Historical Society and Colorado Department of Transportation",40.15899,-103.21724,"425 W 1st St","Akron",,"Washington County","Colorado","It is at the intersection of West 1st Street (U.S. 34) and Custer Avenue, on the left when traveling west on West 1st Street. ",,https://www.hmdb.org/m.asp?m=199982,6/15/2022,3/4/2024
200383,,"Colorado City",,,1940,"the State Historical Society of Colorado from the Mrs. J. N. Hall Foundation and by the El Paso County Pioneers Association and The City of Colorado Springs.",38.84665,-104.86142,,"Colorado Springs","Old Colorado City","El Paso County","Colorado","It is on Colorado Avenue west of South 24th Street, on the right when traveling west. ",,https://www.hmdb.org/m.asp?m=200383,6/20/2022,2/7/2023
200386,,"Log House",,,1959,"the State Historical Society of Colorado through the Mrs. J.N. Hall Foundation.",38.84679,-104.86156,,"Colorado Springs","Old Colorado City","El Paso County","Colorado","It is on Colorado Avenue west of South 24th Street, on the right when traveling west. ",,https://www.hmdb.org/m.asp?m=200386,6/20/2022,2/7/2023
200613,,"Golden Gate Toll Road",,,1938,"Daughters of Colorado",39.77300,-105.24800,,"Golden","Golden Gate Canyon","Jefferson County","Colorado","It is on Golden Gate Canyon Road (County Highway 70) 1.1 miles west of Highway 93, on the right when traveling west. ",,https://www.hmdb.org/m.asp?m=200613,6/24/2022,2/7/2023
200983,,"Philadelphia Toboggan Co. Carousel #6","1905","A National Historic Landmark",,"The People of Kit Carson County",39.30906,-102.27091,"815 North 15th Street","Burlington",,"Kit Carson County","Colorado","It is at the intersection of North 15th Street and Colorado Avenue, on the left when traveling north on North 15th Street. ",,https://www.hmdb.org/m.asp?m=200983,6/29/2022,12/24/2024
201049,,"Battle of Beecher Island",,,2001,"Colorado Historical Society and Colorado Department of Transportation",40.11895,-102.66044,,"Yuma",,"Yuma County","Colorado","It is at the intersection of U.S. 34 and County Highway J, on the right when traveling west on U.S. 34. ",,https://www.hmdb.org/m.asp?m=201049,7/1/2022,6/16/2024
201050,,"Yuma",,,2001,"Colorado Historical Society and Colorado Department of Transportation",40.11892,-102.66044,,"Yuma",,"Yuma County","Colorado","It is at the intersection of U.S. 34 and County Highway J, on the right when traveling west on U.S. 34. ",,https://www.hmdb.org/m.asp?m=201050,7/1/2022,12/24/2024
201078,,"Zebulon Pike, Soldier-Explorer",,,1906,"Pike Monument Association",38.83439,-104.82787,"31 W Pikes Peak Ave","Colorado Springs","Downtown","El Paso County","Colorado","It is on West Pikes Peak Avenue east of South Sierra Madre Street, on the right when traveling east. ",,https://www.hmdb.org/m.asp?m=201078,7/1/2022,2/7/2023
201102,,"Old Colorado City","Founded August 12, 1859",,,,38.84642,-104.86118,"2408 W Colorado Ave","Colorado Springs","Old Colorado City","El Paso County","Colorado","It is at the intersection of South 24th Street and Colorado Avenue, on the right when traveling south on South 24th Street. ",,https://www.hmdb.org/m.asp?m=201102,7/1/2022,7/9/2024
201106,,"Van Briggle Pottery",,"Colorado College",,,38.85055,-104.82968,"1125 Glen Ave","Colorado Springs","East Colorado Springs","El Paso County","Colorado","It is on Glen Avenue south of Uintah Street, on the left when traveling south. ",,https://www.hmdb.org/m.asp?m=201106,7/1/2022,2/7/2023
201136,,"Birth of a Town",,,,"City of Colorado Springs Parks, Recreation and Cultural Services.",38.84671,-104.86157,"2408 W Colorado Ave","Colorado Springs","Old Colorado City","El Paso County","Colorado","It is on Colorado Avenue west of South 24th Street, on the right when traveling west. ",,https://www.hmdb.org/m.asp?m=201136,7/2/2022,2/7/2023
201139,,"Cabin on the Move",,,,"City of Colorado Springs Parks, Recreation and Cultural Services.",38.84671,-104.86155,"2408 W Colorado Ave","Colorado Springs","Old Colorado City","El Paso County","Colorado","It is on Colorado Avenue west of South 24th Street, on the right when traveling west. ",,https://www.hmdb.org/m.asp?m=201139,7/2/2022,2/7/2023
201144,,"Old Colorado City",,,,"City of Colorado Springs Parks, Recreation and Cultural Services.",38.84669,-104.86154,"2408 W Colorado Ave","Colorado Springs","Old Colorado City","El Paso County","Colorado","It is on Colorado Avenue west of South 24th Street, on the right when traveling west. ",,https://www.hmdb.org/m.asp?m=201144,7/2/2022,2/7/2023
202572,,"The First Stake of the Fountain Colony",,,1983,"Daughters of the American Revolution D.A.R.",38.83370,-104.82498,"1 E Pikes Peak Ave","Colorado Springs","Downtown","El Paso County","Colorado","It is at the intersection of Pikes Peak Avenue and South Cascade Avenue, on the right when traveling east on Pikes Peak Avenue. ",,https://www.hmdb.org/m.asp?m=202572,7/23/2022,2/7/2023
202817,,"Northglenn Veterans Memorial",,,2003,"City of Northglenn and American Legion Post 22",39.91010,-104.98740,"11801 Community Center Drive","Northglenn",,"Adams County","Colorado","It is on Community Center Drive, 0.7 miles south of East 120th Avenue, on the right when traveling south. ",,https://www.hmdb.org/m.asp?m=202817,7/27/2022,7/27/2022
203311,,"Historic City Hall",,,,"Historic Downtown Brighton; Brighton Historic Preservation Commission; and Brighton Urban Renewal Authority",39.98638,-104.81729,"22 South 4th Avenue","Brighton",,"Adams County","Colorado","It can be reached from East 160th Avenue (East Bridge Street) (State Highway 7) just east of South 4th Avenue (State Highway 2), on the right when traveling east. ",,https://www.hmdb.org/m.asp?m=203311,8/8/2022,8/8/2022
203401,,"Pierce, Colorado",,,,,40.63664,-104.75375,,"Pierce",,"Weld County","Colorado","It is at the intersection of CanAm Highway (U.S. 85) and Shafer Avenue, on the right when traveling south on CanAm Highway. ",,https://www.hmdb.org/m.asp?m=203401,8/8/2022,8/8/2022
203417,,"State Armory","Built 1921-22",,,,40.42659,-104.69056,"614 8th Avenue","Greeley",,"Weld County","Colorado","It is on 8th Avenue (Business U.S. 85) just south of 6th Street, on the left when traveling south. ",,https://www.hmdb.org/m.asp?m=203417,8/8/2022,7/3/2024
203421,"421","Elitch Theatre",,,2021,"William G. Pomeroy Foundation",39.76850,-105.04630,"4600 West 37th Place","Denver","Northwest","Denver County","Colorado","It is at the intersection of West 37th Place and Vrain Street, on the right when traveling east on West 37th Place. ",,https://www.hmdb.org/m.asp?m=203421,8/8/2022,1/9/2025
203431,,"Theatre Alumni","The Historic Elitch Theatre",,,"The Historic Elitch Theatre",39.76842,-105.04613,"4600 West 37th Place","Denver","Northwest","Denver County","Colorado","It is on West 37th Place just east of Vrain Street, on the right when traveling east. ",,https://www.hmdb.org/m.asp?m=203431,8/8/2022,2/7/2023
